text,method,group_id,hate_speech,christianity_related,annotation_id,annotator,average_prob,created_at,id,lead_time,model_votes,sampling_strategy_tag,updated_at
世田谷カトリック教会、！で聖母マ。リアに会う | 。世界一周 2018.12.！24 2019！。.01.03。 ...？☆世界一周日記　久井真奈美仕事帰り·にミ。サ？に少し、参加？し·たかっ·たのですが、空腹に勝てず。聖母マリ？...ア？に挨拶だけ。して帰宅しました。ア？ジアが？。目を覚ま、すとき：アートが変われば世界が変。わる 1960年...代-1990年代,BT_DeepL_EN_AEDA,159,否,是,4928,1,0.6379961669445038,2026-02-23T14:03:31.047231Z,20246,4.535,1/5,uncertain_or_low_confidence,2026-02-23T14:03:31.047256Z
カトリ？ック世田谷教会でマ？リア様に会う？ | 世界ぐるぐる 2018.1、2.24 、！2019.0。1.03 ☆まいにちぐるぐるKunii Manami 仕事後に少しミサ！、に参...加。し！たかったけど、空腹に勝てず、マリア？様にご挨拶だけして帰宅。 『アジアにめざめたら！』アートが、変わる 世。界が変！、わる 196？·0年代-·1990年代,AEDA_Only,159,否,是,4928,1,0.6379961669445038,2026-02-23T14:03:31.047231Z,20246,4.535,1/5,uncertain_or_low_confidence,2026-02-23T14:03:31.047256Z
マリアの母胎にではなく、永遠にてキリストの存在が始まったのである。以上。 | Controversy eXtraordinary (日本語) Controversy eXtraordinary (日本語): マリアの母胎にではなく、永遠にてキリストの存在が始まったのである。以上。,original,160,否,是,3856,1,0.4320350587368011,2026-02-18T03:51:18.191183Z,20247,4.099,1/5,uncertain_or_low_confidence,2026-02-18T03:51:18.191226Z
キリストの存在は、マリアの胎内ではなく、永遠に始まった。それだけのことだ。 | 論争エクストラオーディナリー（日本語）論争エクストラオーディナリー（日本語）：キリストの存在は、マリアの胎内ではなく、永遠に始まった。それだけのことだ。,BT_DeepL_EN,160,否,是,3856,1,0.4320350587368011,2026-02-18T03:51:18.191183Z,20247,4.099,1/5,uncertain_or_low_confidence,2026-02-18T03:51:18.191226Z
キリ！·スト、の存在は、マリア...の胎内ではな？く、永遠...に始まった。それだ...けのことだ。· 、| 論争エクス。トラオーディナリー（日本·語）論·争エクス、トラオーデ？ィナリー（日本語）：キリストの存在は、マリアの胎·内で·はなく、、永。遠に、始まった。それだ！けのことだ。,BT_DeepL_EN_AEDA,160,否,是,3856,1,0.4320350587368011,2026-02-18T03:51:18.191183Z,20247,4.099,1/5,uncertain_or_low_confidence,2026-02-18T03:51:18.191226Z
マ·リア。の母胎にではなく、！永遠にてキリ...·スト？の存在が始まったのであ...る。以上。 | Controversy eX。tra...ordinary (日本語) Controversy eXtra、ordi、·nary (·日本語):？ マリ·アの母胎にではなく、永遠にてキリストの存在が始まった！のである。以上。,AEDA_Only,160,否,是,3856,1,0.4320350587368011,2026-02-18T03:51:18.191183Z,20247,4.099,1/5,uncertain_or_low_confidence,2026-02-18T03:51:18.191226Z
妹は安倍と統一教会の関係性を認識してると証言してるぞ,original,161,是,是,980,1,0.3696045378843943,2026-02-03T00:56:44.097823Z,20254,7.179,3/3,uncertain_or_low_confidence,2026-02-03T00:56:44.097838Z
私の姉は、安倍と統一教会の関係について認識していると証言した。,BT_DeepL_EN,161,是,是,980,1,0.3696045378843943,2026-02-03T00:56:44.097823Z,20254,7.179,3/3,uncertain_or_low_confidence,2026-02-03T00:56:44.097838Z
私の姉は！、安倍と統一教会の関係について認、識していると証？。言した...。,BT_DeepL_EN_AEDA,161,是,是,980,1,0.3696045378843943,2026-02-03T00:56:44.097823Z,20254,7.179,3/3,uncertain_or_low_confidence,2026-02-03T00:56:44.097838Z
妹は...安倍と統一教·会の関係性を認識してると証言してるぞ,AEDA_Only,161,是,是,980,1,0.3696045378843943,2026-02-03T00:56:44.097823Z,20254,7.179,3/3,uncertain_or_low_confidence,2026-02-03T00:56:44.097838Z
壺が捏造歴史観捏造戦争責任に基づき日本から金銭巻き上げ永久機関構築目的の ウリストゴミカスカルトとはいえ 山上愚母に壺が強制したとか人質に取ったとか脅迫恐喝したってのとか、 詐欺ったとか認知症の人間を誑かしてとかそういうのでもなく いくら壺が教義や体質諸々で何もかもがクソ粕でも、山上愚母は精神的に依存し極度の浪費で 自らへの遺産や夫の死亡保険金という、子供や家族に本来使うはずの金を注ぎ込んで壺に献金して 自らの欲求を満たしていたという事実は変わらず 家族がいくら止めたり、壺から返金させても一向に懲りず家族を蔑ろにしての所業だしなぁ… 壺は徹底的に活動禁止して取り締まれ、海外流出した金を取り戻せ、教祖ババアや朝鮮人幹部を指名手配し 日本への身柄引き渡して逮捕しろ 破防法強化して反社団体認定しろとまで思うけど ただ、結局のところ暴走して家族すら止められない浪費に明け暮れた個人が元凶なわけで 脱会したり反省して無茶苦茶しないように本人が自省したりしないと いくら家族や周囲が返金させても一時しのぎで元の木阿弥で際限がなく、肝心な問題は解決しないわけで… となるとどうしても極度の浪費してしまう対象者の大人の個人の金銭や行動の大幅な制限という 個人の権利の領域への強制力の何かしらの行使、に踏み込まざるを得なくなってしまうわけで… そのあたりどこまでやりゃーいいんだろうね？ 水商売系とかロマンス詐欺とか博打や投資での浪費のケースにもってなるし 誰がどのようにどの範囲でとか、いろいろ面倒くさいことになってくるわなぁ…,original,162,是,是,5097,1,0.4107506374518077,2026-02-24T10:01:02.449332Z,20262,67.669,4/2,uncertain_or_low_confidence,2026-02-24T10:01:02.449346Z
壺のカルトは、でたらめな歴史観とでっち上げた戦争責任を根拠に日本から金をゆすり取り、永久に金を搾り取る機械を作ろうとする、くだらないカルト信者のクズどもに過ぎないが、山上の母親を壺に入信させるために強制したり、人質に取ったり、脅迫や恐喝をしたり、詐欺をかけたり、認知症の人を騙したりといったことは、決してしていない。 ツボの教義や規約がどれほどくだらないものであれ、山上の母親は精神的に依存し、子供や家族のために用意された遺産や夫の生命保険金といった資金を、自らの欲望を満たすためにカルトへの寄付に浪費した。この事実は変わらない。 家族が止めようと訴え、カルトに返金を要求しても、彼女は一切反省せず家族を完全に無視した…カルトは徹底的に禁止・摘発すべきだ。海外に流出した資金を回収せよ。老婆カルト教祖と韓国人幹部に手配書を発行し、日本へ引き渡し逮捕せよ。暴力団対策法を強化し反社会的勢力に指定せよ。 そう考える。しかし、究極的には、家族すら止められないほど金銭を浪費して暴走した個人に根本原因がある。彼らがカルトを離れ、反省し、無謀な行動をしない決意を固めなければ——真に更生しなければ——家族や他者が強制した返金は一時的な対処に過ぎない。元に戻り、終わりがなく、核心的な問題は解決されないまま… そうなると必然的に、個人の権利を侵害する何らかの強制力が必要になる——極端な浪費癖のある成人の支出や行動を大幅に制限する手段だ…では、その境界線はどこに引くべきか？風俗産業への支出、ロマンス詐欺、ギャンブル、無駄な投資などが該当する…誰が、どうやって、どこまで介入するのか？全てが非常に複雑になるだろう？,BT_DeepL_EN,162,是,是,5097,1,0.4107506374518077,2026-02-24T10:01:02.449332Z,20262,67.669,4/2,uncertain_or_low_confidence,2026-02-24T10:01:02.449346Z
壺のカルトは、でたらめな歴史観とで。っち！上げた戦争責任を根拠に日？本から金をゆすり。取り、永久に金を搾り取る機！械を作ろう...とする、くだらな？いカルト信者のクズどもに過ぎない、が、山上の母親を壺に入信させるために強制したり、人質に取ったり、脅迫や·？恐喝をしたり、詐欺をかけたり、認知症の人を騙したり？？、といっ。たことは...、決し。·てしていない。 ツボの教義や規約が。·どれほどくだらないものであ·れ、山上の母親は精神的に依存し、！子。供や。家族のために用！意された遺産や夫の生命保！険金といった資金を、自らの欲望？を満たすため...にカルトへの寄付に浪費した。この事実は...変わら·ない。 。家？族が止·めようと訴え、カル？トに返金を要求して、も...、彼女は一。切反省せず家族を完全に無視した…カルトは徹底的に禁止・摘発すべ？きだ。海？外に流出した資金を回収せよ·。老婆カルト教祖と韓国人幹部に手配書...を発行し、...日！本へ引！き渡し逮、捕せよ。暴力団対策法を強化し反社会的勢力に指定せよ。· そう考える。し！かし...、·究！極的には、家族すら止められない！、ほど金銭を浪費！して暴走した個人に根。...本原因·。？が...ある。彼らがカルトを離れ、反省し、無謀·な行動をしない決意。を固めなけ。れ·！ば——真に更生しなければ——家族や他者が強制した返金は一。時的な対処·に過...ぎ...ない。元に戻り、！終わりがなく、核心的な問題は、解決さ·れ。ないまま… 。そうな！ると必然的に、個人の権利を侵害す！る何らかの強。制力が必要になる。——極端·な浪費癖、の、ある成人·の？支出や行動を大幅に制限する手段だ…では、そ...の境界線？は？ど！こに。引く。、べきか、？風俗産業への支出、ロマンス詐欺、ギャンブル、無·、駄な投資、などが該当す！る…誰が、どうやって、どこまで！介入するのか？全？てが非常に複雑·になるだろう？,BT_DeepL_EN_AEDA,162,是,是,5097,1,0.4107506374518077,2026-02-24T10:01:02.449332Z,20262,67.669,4/2,uncertain_or_low_confidence,2026-02-24T10:01:02.449346Z
壺が捏造？。歴。史観捏造戦·争責任に基。づ·き。日本から、金銭巻き上、げ永久機関構築目的の ...ウリストゴミカスカルトとはいえ 山上愚、母に壺が強制したとか人質に取っ、たとか脅迫。恐喝したって？のとか、 詐欺ったとか認知症の人間を誑かしてとかそ？ういうのでもなく いくら壺が教？義や体質諸！々で何もかもがク。ソ粕でも、山上愚母は精神的に依存し極度の浪費？で· 自らへの遺産や夫の死·亡保険金という、子...供や家·族に本？来使うはず...！の、。金を注ぎ...込んで壺に献金して 自らの、欲求を満た、していた...という事実は変わらず！ 家族がいくら、止めたり、壺？から返金させても一向に懲りず家族を蔑ろにしての所業だしなぁ… 壺は徹底的に活！動禁止！して取り締まれ、海外流出した金を。取り戻せ、！教祖ババアや朝鮮人幹部を指。名·...手配し 日本への身柄引き渡して逮捕しろ 破？防、法。強化し、て反...社団体認·？、定しろとまで。思う。けど ただ、結局のところ。暴走して·家族すら止められない浪費に明け暮·れた個、人...が元。凶、なわけ·で 脱。会したり反省して無·茶苦茶しないよ！うに本人が、、自省したりしないと？ いくら家？族や周囲が？返金させても一時しのぎで·元の木...阿弥で際限がなく、肝心？な問題は解決しないわけで… とな！るとどうしても。極度の·浪！。費し·？てしまう！対象者の大人の個人の金銭や行。動·の大幅...な制限という 個人の権利の領域への強制力？の何かしら？。の行使、に！踏み込まざるを！得なくなってし！まうわけで… そ！のあたりどこまで·やりゃーいいんだろうね？ 水商売系とかロマンス詐欺とか博打や投資での浪費の·ケースに！も？って、なるし· 誰がどのようにどの範囲でとか、いろいろ面倒くさいことにな。ってく...るわな·ぁ…,AEDA_Only,162,是,是,5097,1,0.4107506374518077,2026-02-24T10:01:02.449332Z,20262,67.669,4/2,uncertain_or_low_confidence,2026-02-24T10:01:02.449346Z
■anond:20180918040720 LORD? 金日成？ よくわからん...... Lord を Load と綴り間違えたのをからかって「荷物を乗せるな」と言ったんじゃないの？ ■anond:20180918004633 俺は帰国でもキリスト教徒でもないけどLORDを某地域における金日成みたいに書くのは一般社会常識だろ…,original,163,是,是,1363,1,0.4479904075463612,2026-02-08T07:31:10.277320Z,20267,32.17,3/3,uncertain_or_low_confidence,2026-02-08T07:31:10.277339Z
■ anond:20180918040720 主？金日成？よくわからないな… 「ロード」を「ロード」と誤記したのをからかって「貨物を積むな」と言ったのかも？■anond:20180918004633 私は帰還民でもキリスト教徒でもないが、ある地域で金日成のようにLORDと書くのは社会の常識だ…,BT_DeepL_EN,163,是,是,1363,1,0.4479904075463612,2026-02-08T07:31:10.277320Z,20267,32.17,3/3,uncertain_or_low_confidence,2026-02-08T07:31:10.277339Z
■ a...nond:201809180。40？720 主？金日·成？？よくわからないな… 「ロード」...を「ロード」と誤記したのをからかって「貨物を積むな」と言ったのかも？■anond:20...18091800...4633 私は帰還？民で。もキリスト、教徒でもないが、ある地域で金。。日成のよう？にLORDと書くの、は社会の常識だ…,BT_DeepL_EN_AEDA,163,是,是,1363,1,0.4479904075463612,2026-02-08T07:31:10.277320Z,20267,32.17,3/3,uncertain_or_low_confidence,2026-02-08T07:31:10.277339Z
■。anond:、2·01809180？40720 LORD? 金日成？... よ...·くわからん......· Lor...d ...を Load と綴り間、。違えたのをからかって「荷物を乗せるな」と言ったん·じゃないの？· ■anond:201？...80918004633 俺。は帰国で·もキ...リスト教徒で？もないけど·LORDを某地域にお。ける金日成...みたいに。書くのは。一般社会常識だろ…,AEDA_Only,163,是,是,1363,1,0.4479904075463612,2026-02-08T07:31:10.277320Z,20267,32.17,3/3,uncertain_or_low_confidence,2026-02-08T07:31:10.277339Z
堀江は統一教会は悪くない 安倍晋三も悪くない 悪いのは勝手に金をつぎ込んだ 母親だと いっている ひろゆきは統一教会が 全て悪いと言っている,original,164,是,是,1484,1,0.4366476237773895,2026-02-10T14:27:07.379081Z,20276,6.484,4/2,uncertain_or_low_confidence,2026-02-10T14:27:07.379107Z
堀江氏は統一教会は悪くないと言う。安倍晋三も悪くない。悪いのは彼の母親で、許可なく金を注ぎ込んだ。広之氏は統一教会に全責任があると主張する。,BT_DeepL_EN,164,是,是,1484,1,0.4366476237773895,2026-02-10T14:27:07.379081Z,20276,6.484,4/2,uncertain_or_low_confidence,2026-02-10T14:27:07.379107Z
堀江氏は統·一教会は悪くないと言う。安倍晋三も悪くない。悪いの。は彼の母親で...、·許可な。く...金を注ぎ込んだ。？？広·之氏は統一？教会に全責任があると主張する。,BT_DeepL_EN_AEDA,164,是,是,1484,1,0.4366476237773895,2026-02-10T14:27:07.379081Z,20276,6.484,4/2,uncertain_or_low_confidence,2026-02-10T14:27:07.379107Z
堀江は！統一教会は悪くない 安、倍晋三·！も悪くない 、悪いのは勝手に金をつぎ込んだ 母親だと いっている ひろゆ。きは統一教会？が！、 全て？悪いと言...っ...ている,AEDA_Only,164,是,是,1484,1,0.4366476237773895,2026-02-10T14:27:07.379081Z,20276,6.484,4/2,uncertain_or_low_confidence,2026-02-10T14:27:07.379107Z
カトリック中央協議会やカトリックニュースジャパンのサイトを見ればわかるが、 反日、反戦、反核、など胡散臭い主張の数々。 こんなのを見て入信したいと思う日本人がいると思うか？ 日本人の信者数が減少してるのは司教が原因だろ。 日本国内の外国人信者数が増えればいいというものではない。 宗教は霊魂の救済のためにある。 胡散臭い活動のためではない。,original,165,是,是,1286,1,0.3960898319880168,2026-02-05T14:36:21.808311Z,20283,13.648,2/4,uncertain_or_low_confidence,2026-02-05T14:36:21.808326Z
カトリック司教協議会やカトリックニュースジャパンのウェブサイトを見ればわかるが、反日・反戦・反核といった怪しげな主張ばかりだ。これを見て日本人が改宗したいと思うだろうか？信徒減少は司教たちの責任だ。外国人の信徒を増やすだけでは不十分である。宗教は魂の救済のために存在する。怪しげな活動のためではない。,BT_DeepL_EN,165,是,是,1286,1,0.3960898319880168,2026-02-05T14:36:21.808311Z,20283,13.648,2/4,uncertain_or_low_confidence,2026-02-05T14:36:21.808326Z
カトリック司教協議·会やカト。リ？...ックニュー？スジ...ャパンのウェブサイトを見れ·ばわか·るが、反日・、反戦・反核といった怪しげな主？張？ばかりだ。これを見て日本人が·改宗したいと思うだろう·か？信徒減少、は司教たちの責任だ·。外国人の信徒を増やすだけでは不十分である。宗教は！魂の救済のため、に存在する。怪しげな活動の...た、めではない。,BT_DeepL_EN_AEDA,165,是,是,1286,1,0.3960898319880168,2026-02-05T14:36:21.808311Z,20283,13.648,2/4,uncertain_or_low_confidence,2026-02-05T14:36:21.808326Z
カトリック中央協？議会やカトリックニュースジャパンのサイトを見れ、ばわかるが、 反日、反戦、反？·核、など胡散臭、い主張の数々。 こんなのを見て入信したいと思う日本人がいる、と思うか？、 日本人の信者数が減少して。るのは司教が原因だろ。 日本国！内の？外国人信？者数が、！増えればいいというもので！はない。 宗教は霊、...魂の救済の！た·めにある。 胡散臭い、活動のため、ではない。,AEDA_Only,165,是,是,1286,1,0.3960898319880168,2026-02-05T14:36:21.808311Z,20283,13.648,2/4,uncertain_or_low_confidence,2026-02-05T14:36:21.808326Z
神の業と人間の実践 終わりの日のキリストだけが人に永遠のいのちの道を与えられる 肉となった神と神に使われる人々との間の本質的違い 贖いの時代のおける働きの内幕,original,166,否,是,4984,1,0.4071300725142161,2026-02-23T14:18:01.122543Z,20289,6.899,3/3,uncertain_or_low_confidence,2026-02-23T14:18:01.122559Z
神の働きと人間の実践終末のキリストのみが人に永遠の命への道を授ける神が受肉した者と神に用いられる者との本質的差異贖いの時代の内なる働き,BT_DeepL_EN,166,否,是,4984,1,0.4071300725142161,2026-02-23T14:18:01.122543Z,20289,6.899,3/3,uncertain_or_low_confidence,2026-02-23T14:18:01.122559Z
！神の働！きと？人間の実...践終末のキリストのみが人に永遠の命への道を、授ける...神が受肉した者と神に用·いられる者との、本...質的差、異贖い...の時代の内なる働き,BT_DeepL_EN_AEDA,166,否,是,4984,1,0.4071300725142161,2026-02-23T14:18:01.122543Z,20289,6.899,3/3,uncertain_or_low_confidence,2026-02-23T14:18:01.122559Z
神の業と人間の実践 終わりの日のキリストだけが人に永遠のいのちの道...。を与えられる 肉と！なっ、た神と神に使われる人々との...間の·本質的違い 贖いの時。代のおけ·る働··き！の内！幕？,AEDA_Only,166,否,是,4984,1,0.4071300725142161,2026-02-23T14:18:01.122543Z,20289,6.899,3/3,uncertain_or_low_confidence,2026-02-23T14:18:01.122559Z
人は、変われる。: でじたる異言ノォト « キリスト教のことが面白いほどわかる本 | トップページ | 神社若奥日記 » 投稿者 ちはや 時刻 00:34 スピリチュアリティ | 固定リンク この記事へのトラックバック一覧です： 人は、変われる。:,original,167,否,是,5030,1,0.4705611566702525,2026-02-24T09:35:53.208193Z,20295,3.815,3/3,uncertain_or_low_confidence,2026-02-24T09:35:53.208213Z
人は変われる。：デジタル・タンズ・ノート「キリスト教を驚くほど明快に解説する一冊｜トップページ｜神社の巫女の日記」チハヤ 00:34 投稿 スピリチュアリティ | パーマリンク このエントリーのトラックバック：人は変われる。：,BT_DeepL_EN,167,否,是,5030,1,0.4705611566702525,2026-02-24T09:35:53.208193Z,20295,3.815,3/3,uncertain_or_low_confidence,2026-02-24T09:35:53.208213Z
人。...は変われる。：·デジタル・タンズ・ノート「キリスト教？？...を驚くほど明快。に解説する一冊｜。トップペー......ジ｜神社の巫、女の日記」チハヤ 00、:34 投稿 ス·ピリチュアリ、ティ？ |· ·！パーマリンク このエントリーのトラックバッ·ク：人は変...われる。：、。,BT_DeepL_EN_AEDA,167,否,是,5030,1,0.4705611566702525,2026-02-24T09:35:53.208193Z,20295,3.815,3/3,uncertain_or_low_confidence,2026-02-24T09:35:53.208213Z
。人は、変われる。: でじたる異言ノォト ？«！ キリスト教？。のことが面！、白いほどわかる本？ ...|· トップ、ページ 、| 神社若奥日記 ...» 投稿者 ！ち、はや 時刻、 00:34 スピリチュアリティ。 | 。固定リンク この記事へ...のトラッ、クバック一覧です。： 人は、変われる。:！,AEDA_Only,167,否,是,5030,1,0.4705611566702525,2026-02-24T09:35:53.208193Z,20295,3.815,3/3,uncertain_or_low_confidence,2026-02-24T09:35:53.208213Z
平和を実現する方の掲示（福音） | セブンスデー・アドベンチスト教会 2018年9月8日 @ 10:30 – 12:00 Asia/Tokyo タイムゾーン 2018-09-08T10:30:00+09:00 ← 黙示録に示されているこの世の終わりの徴(時の兆),original,168,否,是,4608,1,0.4348439276218414,2026-02-19T03:15:32.549389Z,20314,10.434,2/4,uncertain_or_low_confidence,2026-02-19T03:15:32.549413Z
平和をもたらす方の宣言 （福音）｜セブンスデー・アドベンチスト教会2018年9月8日 午前10時30分～午後12時00分（アジア/東京時間）2018-09-08T10:30:00+09:00← 黙示録に明らかにされた世界の終わりのしるし（時のしるし）,BT_DeepL_EN,168,否,是,4608,1,0.4348439276218414,2026-02-19T03:15:32.549389Z,20314,10.434,2/4,uncertain_or_low_confidence,2026-02-19T03:15:32.549413Z
平？和を。·もた？らす？方の。宣言 （福音！）...！...｜セブンスデー・！アドベン、チ？スト教、会2·...018年9月8日 午前10時30分～午後12時00分（アジア/東京...時間）2018-...09-08T1！0:30:00+09:00← 黙示録。に、明らかにされた世界の終わりのしるし（時のしるし）,BT_DeepL_EN_AEDA,168,否,是,4608,1,0.4348439276218414,2026-02-19T03:15:32.549389Z,20314,10.434,2/4,uncertain_or_low_confidence,2026-02-19T03:15:32.549413Z
平和を実現する方の掲示（福？音） | セブンス...デー・アドベンチスト教会 20、18年9月8日 @ 1！0:30 – 12:00 Asia/Tokyo タイムゾーン、 2018-09-08T10:3·0·:00+09:00！ ←。 黙示録に、示され！ているこの·世の終わりの徴(時の？兆·),AEDA_Only,168,否,是,4608,1,0.4348439276218414,2026-02-19T03:15:32.549389Z,20314,10.434,2/4,uncertain_or_low_confidence,2026-02-19T03:15:32.549413Z
>>718 善意の実践を「自己犠牲」などと大袈裟に言うお前は楽をしたいだけのクズ。 『』を多用するお前の文って読みづらいから嫌いなんだよね。 Miletへのレスなのにお前が割り込んでくるなよ。 先にお前が答えろ。 カトリック批判への反論なのにルカ18を引用してきたのはズレてないか？ Miletへの反論なのにお前が干渉してきた理由は？,original,169,否,是,3914,1,0.4872436722119649,2026-02-18T03:58:57.394984Z,20328,23.993,3/3,uncertain_or_low_confidence,2026-02-18T03:58:57.395002Z
