annotation_id,annotator,average_prob,christianity_related,created_at,hate_speech,id,lead_time,model_votes,sampling_strategy_tag,text,updated_at,augment_method,group_id
7114,1,0.7549493312835693,1,2026-03-19T12:23:11.771115Z,0,16819,8.024,1/2,uncertain_or_low_confidence,天啦！我一直觉得你是一为成熟的基督徒，别这么模糊不清我们的神是忌邪的神！我也很喜欢@冯小刚 但信养是来不得半点将就的//@快乐小天使路得:中国人说的老天爷就是上帝！上帝的保守，祝福！[蛋糕]快乐！//@神农架韦群: 若能真的能认识耶稣基督并认他做主，你便是新造的人,2026-03-19T12:23:11.771142Z,original,132
7114,1,0.7549493312835693,1,2026-03-19T12:23:11.771115Z,0,16819,8.024,1/2,uncertain_or_low_confidence,天啦。！我一直觉得你是？一为成熟的基督徒，别这么……模糊！不清我们的神是忌邪的神、！我也很喜欢@冯小刚 但信·养是来不得半点将就的//@快乐小天使路得:中国？，人说的老天；爷就是上。帝！上帝的保。守，祝·福！[蛋糕！]快乐！//@神农架韦群: 若能真的能认识耶稣基督并认他做主，你便是新造的人,2026-03-19T12:23:11.771142Z,original_AEDA,132
7114,1,0.7549493312835693,1,2026-03-19T12:23:11.771115Z,0,16819,8.024,1/2,uncertain_or_low_confidence,我的天啊！我一直以为你是个成熟的基督徒，别这么含糊，我们的上帝是忌邪的上帝！我也很喜欢@冯小刚，但信仰是不能妥协分毫的。//@快乐小天使露丝: 中国人说的“老天爷”就是上帝！上帝的保守，祝福！[蛋糕] 快乐！//@神农架微群: 如果你真能认识耶稣基督，承认祂为主，你就是新造的人。,2026-03-19T12:23:11.771142Z,BT_Gemini_Sim0.98,132
7114,1,0.7549493312835693,1,2026-03-19T12:23:11.771115Z,0,16819,8.024,1/2,uncertain_or_low_confidence,我的天啊·！我一直以为你是个成熟的基督；徒，别？这么含糊，我们！的上帝是忌·邪的上·帝！我也很……喜欢@冯小刚，。但！·信；仰是不能！·妥协分毫的。！//，@快乐小天使露丝: 中国人说的“老天爷”就是上帝·！上帝的保守，祝福！[蛋糕] 快。乐！//@！、神农架微群: 如果你真能认识耶稣基督，承认祂为主，你就是新造的人。,2026-03-19T12:23:11.771142Z,BT_AEDA,132
4285,1,0.8849038283030192,1,2026-02-18T11:09:40.806660Z,1,18453,4.657,2/1,uncertain_or_low_confidence,"修女越是禁欲，她在追求男女之事上的反差就越抓人眼球。暗黑地牢的修女也是这样，本质上还是一种反差萌吧。
喜欢我拿着一根小木棍接受天启把身强力壮的惩罚者打至跪地随即从修道院逃离最后把和古神融为一体的主角打败的修女小姐姐吗",2026-02-18T11:09:40.806683Z,original,118
4285,1,0.8849038283030192,1,2026-02-18T11:09:40.806660Z,1,18453,4.657,2/1,uncertain_or_low_confidence,"！修女越是禁欲，她在追求男女之事上的反差就·越抓人眼……球。暗黑地牢的修女？也是这样，本……质？上还……是一。种反；差萌吧。
喜……欢·我拿着一根小木棍接受天启……把身强力壮的惩罚者打至跪、地随即从修道院逃离最后把和古神融为一体的主角打败的修女小姐姐吗",2026-02-18T11:09:40.806683Z,original_AEDA,118
4285,1,0.8849038283030192,1,2026-02-18T11:09:40.806660Z,1,18453,4.657,2/1,uncertain_or_low_confidence,"修女越是禁欲，她在性事上的追求所产生的反差就越是引人注目。《暗黑地牢》里的修女也是如此；本质上，这不就是一种反差萌吗？
你喜欢那个修女女孩吗？她手持一根小木棍，获得神启，将强大有力的惩罚者打得跪地求饶，然后立刻逃离修道院，最终击败了与古神融合的主角。",2026-02-18T11:09:40.806683Z,BT_Gemini_Sim0.91,118
4285,1,0.8849038283030192,1,2026-02-18T11:09:40.806660Z,1,18453,4.657,2/1,uncertain_or_low_confidence,"修女越是·禁欲，她在性事上的追求所产！生……的反差就越是引人注目。《暗？黑地牢》……里。的修；女也是如此；本质上，？这不就是一种反差萌吗？
你喜欢？那个修！女女孩吗？她手持一根小木棍，获得神、启，将强大有力的惩罚者打得跪地求饶，然后；立？刻逃离修道、院，最终击败了与古神融合的主角。",2026-02-18T11:09:40.806683Z,BT_AEDA,118
7939,1,0.7367597619692484,1,2026-03-23T11:16:31.976918Z,0,17669,2.909,1/2,uncertain_or_low_confidence,首先肯定在狠人至少太古之后，太古是没有荒古禁地的，圣体又是在狠人之前就化禁区的所以太古之后狠人之前，具体什么时间就不好说了，只知道圣体成长期间长生起来过，他两有过一段恩怨。,2026-03-23T11:16:31.976941Z,original,135
7939,1,0.7367597619692484,1,2026-03-23T11:16:31.976918Z,0,17669,2.909,1/2,uncertain_or_low_confidence,首先？肯定在狠人！至少太古之后，，太古是没有荒古！禁地的，圣体又是？在狠人之前就化禁区的所以太古之后狠人之·前，具体什…………么时间就不好说了，只知道圣体；成长期间长生起来过，他两·有过一段恩怨。,2026-03-23T11:16:31.976941Z,original_AEDA,135
7939,1,0.7367597619692484,1,2026-03-23T11:16:31.976918Z,0,17669,2.909,1/2,uncertain_or_low_confidence,首先，肯定是在狠人之后，至少在太古时代之后。太古时代没有荒古禁区，而圣体在狠人之前就已经化为禁区了。所以，太古时代之后、狠人之前具体的时间很难确定。只知道长生在圣体成长时期出现，两人有过一段恩怨。,2026-03-23T11:16:31.976941Z,BT_Gemini_Sim0.94,135
7939,1,0.7367597619692484,1,2026-03-23T11:16:31.976918Z,0,17669,2.909,1/2,uncertain_or_low_confidence,首先。，肯定是在狠人之后，至少在？太古时代之后。太古时代没有荒古禁区，而圣体在狠；人之前就已经化为禁区了。？。、所以，太古时代之后·、狠人之前具体的时间很难确定。只知道长生在圣？体成长时期出，现，两人有过一段恩怨。。，,2026-03-23T11:16:31.976941Z,BT_AEDA,135
2182,1,0.7517619927724203,1,2026-02-13T05:42:32.087789Z,0,16156,3.292,1/2,uncertain_or_low_confidence,"“你们不是吃你们所见的这身体，也不是喝那将要为钉我十字架之人所流的血。我已为你们设立圣餐；若以属灵方式领受，它必使你们复活。”
圣餐仅在蒙拣选者身上实现其所象征的意义。他们岂敢否认饼象征基督复活之身体？",2026-02-13T05:42:32.087809Z,original,143
2182,1,0.7517619927724203,1,2026-02-13T05:42:32.087789Z,0,16156,3.292,1/2,uncertain_or_low_confidence,"“你们不是吃你们所见的这身·体，也不是喝·那将要为钉我十字架·之人所流的；；、血。我已为你们设立、圣餐；若以属灵方式领受，它必……使你们复活。”
圣？餐仅在蒙拣选者？身上实现其所象征的意义。他们岂敢否认饼象征基督复活之。？身体？",2026-02-13T05:42:32.087809Z,original_AEDA,143
2182,1,0.7517619927724203,1,2026-02-13T05:42:32.087789Z,0,16156,3.292,1/2,uncertain_or_low_confidence,"“你们不吃你们所见的这身体，也不喝将为那些把我钉上十字架的人所流的血。我已为你们设立了圣餐；若以属灵的方式领受，它将使你们复活。”
圣餐只在被拣选者身上实现其象征意义。他们怎敢否认饼象征着基督复活的身体？",2026-02-13T05:42:32.087809Z,BT_Gemini_Sim0.99,143
2182,1,0.7517619927724203,1,2026-02-13T05:42:32.087789Z,0,16156,3.292,1/2,uncertain_or_low_confidence,"“你们不吃你们所见的这身体，也不喝将为那些把我，钉上十字架的人所流的血。我已为你们设立·了圣餐；若以属灵的方式领；受，、它，将使你们复活。”
、圣餐只在被拣选者身上实现其象征意义。他·们……怎敢否认饼象征着基督复活的，身体？、",2026-02-13T05:42:32.087809Z,BT_AEDA,143
6919,1,0.7136683662732443,1,2026-03-19T11:36:59.313680Z,0,17737,4.779,1/2,uncertain_or_low_confidence,可惜很多基督徒并没有这种敬虔的气质；他们也许天赋极高，风度好，或忙于主工，或甚至在某些圣工上有明显的成就，但仍然不是敬虔的人。为什么？因为他们不是献身于神。他们可能是献身于一个感动、一项事工，或为着自己的基督徒声誊而努力，却不是为神的缘故。,2026-03-19T11:36:59.313702Z,original,138
6919,1,0.7136683662732443,1,2026-03-19T11:36:59.313680Z,0,17737,4.779,1/2,uncertain_or_low_confidence,可惜很多基督徒并没有这种敬虔的气质；他们，也许天。赋极高，风度好；，或忙于主工，或甚！至在某些圣工上？有明显的成；就，但仍然不是敬虔的人。为！什么？因为……他们不是献身于神。他们可能是献、身于一个，感动、……一项事工，或为着自己，的基……督徒声誊而努力，却不是为神、的缘故。,2026-03-19T11:36:59.313702Z,original_AEDA,138
6919,1,0.7136683662732443,1,2026-03-19T11:36:59.313680Z,0,17737,4.779,1/2,uncertain_or_low_confidence,不幸的是，许多基督徒不具备这种敬虔的性情；他们可能很有恩赐，举止得体，或者忙于主的工作，甚至在某些神圣的事工中有显著的成就，但他们仍然不是敬虔的人。为什么？因为他们没有奉献给神。他们可能奉献给一种灵感，一个事工，或者努力争取自己的基督徒声誉，但不是为了神。,2026-03-19T11:36:59.313702Z,BT_Gemini_Sim0.97,138
6919,1,0.7136683662732443,1,2026-03-19T11:36:59.313680Z,0,17737,4.779,1/2,uncertain_or_low_confidence,；不，、幸的是，许·多基督徒不具备。这种敬虔的性情；他们可能很有恩赐，举止得体，或者忙于主；的工作，甚至在某些神圣的事工中有，显著·的成就，但、、他们仍然，。！不是敬；虔的人。为什么？因为他们没有奉献给神。他！们可能奉献……给一种灵感，一个事工，或者努力争取自己的基督徒声誉，！但不是为了神。,2026-03-19T11:36:59.313702Z,BT_AEDA,138
5397,1,0.8423406084378561,1,2026-02-26T02:06:49.506014Z,0,15401,3.001,1/2,uncertain_or_low_confidence,Following gods lead //@每日圣经研读: 人所行的，在自己眼中都看为正，惟耶和华衡量人心。,2026-02-26T02:06:49.506039Z,original,146
5397,1,0.8423406084378561,1,2026-02-26T02:06:49.506014Z,0,15401,3.001,1/2,uncertain_or_low_confidence,Followi？ng gods lead //@每日圣经研、读: 人所行。的，在自己眼中都看为正，？惟耶；；和华衡量人心。,2026-02-26T02:06:49.506039Z,original_AEDA,146
5397,1,0.8423406084378561,1,2026-02-26T02:06:49.506014Z,0,15401,3.001,1/2,uncertain_or_low_confidence,跟随神的指引 //@每日圣经学习: 一个人所行的，在自己眼中都看为正直，唯有耶和华衡量人心。,2026-02-26T02:06:49.506039Z,BT_Gemini_Sim0.88,146
5397,1,0.8423406084378561,1,2026-02-26T02:06:49.506014Z,0,15401,3.001,1/2,uncertain_or_low_confidence,跟随……神的指引。 //@每日圣经学习: 一。个人所行的，在自己眼中都看为正……直，唯有耶和华衡量人心。。,2026-02-26T02:06:49.506039Z,BT_AEDA,146
505,1,0.7846349477767944,1,2026-02-02T12:15:20.802408Z,0,18640,5.465,1/2,uncertain_or_low_confidence,国内已经是快大年夜的节奏了，我们在赶往苏萨古城的路上，周杰伦的《爱在西元前》就是唱的这里，耶稣基督出生时的东方三圣也是来自这里…下午五点的飞机飞色拉子。 我在这里:http://t.cn/8FJzMyr,2026-02-02T12:15:20.802426Z,original,148
505,1,0.7846349477767944,1,2026-02-02T12:15:20.802408Z,0,18640,5.465,1/2,uncertain_or_low_confidence,国内已经是……快大年夜的节奏了，我们在赶往苏萨古城的路上，周杰。伦！的《爱在西元，前》就是？唱的这，里……，耶稣基督出生时的，东方三圣也是来自这里…下午五点的飞机飞色拉子。 我在这里:？http://t.c·n/8FJz、；Myr,2026-02-02T12:15:20.802426Z,original_AEDA,148
505,1,0.7846349477767944,1,2026-02-02T12:15:20.802408Z,0,18640,5.465,1/2,uncertain_or_low_confidence,国内快过年了。我们正在去古城苏萨的路上。周杰伦的《爱在西元前》唱的就是这里，耶稣基督诞生时的东方三博士也来自这里……5点飞设拉子。我在这里：http://t.cn/8FJzMyr,2026-02-02T12:15:20.802426Z,BT_Gemini_Sim0.87,148
505,1,0.7846349477767944,1,2026-02-02T12:15:20.802408Z,0,18640,5.465,1/2,uncertain_or_low_confidence,国内？快过年了。我们正，在去·古城苏萨的路上。周杰伦的《爱；在西元前》唱的就是，这里，耶稣基督诞生时的东方；三博士也来自这里…？…5……点飞设拉子。我在这里：http://t.cn/8FJzMyr？,2026-02-02T12:15:20.802426Z,BT_AEDA,148
7328,1,0.7503514091173807,1,2026-03-19T12:45:12.938507Z,0,18982,3.703,1/2,uncertain_or_low_confidence,强大自我，传递善意。让上帝的归上帝，傻逼的归傻逼。//@陈刚jerry：思考。,2026-03-19T12:45:12.938526Z,original,139
7328,1,0.7503514091173807,1,2026-03-19T12:45:12.938507Z,0,18982,3.703,1/2,uncertain_or_low_confidence,强大，自我，传递善意！。让上帝的归！上帝，傻逼的归傻逼。//@陈刚jerry：思考。·,2026-03-19T12:45:12.938526Z,original_AEDA,139
7328,1,0.7503514091173807,1,2026-03-19T12:45:12.938507Z,0,18982,3.703,1/2,uncertain_or_low_confidence,强大自己，传播善意。神的物当归神，傻逼的物当归傻逼。//@Chen Gangjerry: 思考。,2026-03-19T12:45:12.938526Z,BT_Gemini_Sim0.96,139
7328,1,0.7503514091173807,1,2026-03-19T12:45:12.938507Z,0,18982,3.703,1/2,uncertain_or_low_confidence,强！大自。己，传！播善意。神的？物当归神，傻逼的物当归傻逼。//@Chen Gangje！rry: 思考。,2026-03-19T12:45:12.938526Z,BT_AEDA,139
5623,1,0.8005539973576864,1,2026-02-28T05:33:28.187229Z,0,16323,12.166,2/1,uncertain_or_low_confidence,"古代那些传教士，自己贴钱都要去传教，比如明末清朝那些耶稣会，自己建修会，自己也出钱，还自己让自己听教皇指挥
儒家？有几个免费教人子弟识字的？
道士？道士辩经的平均能力可能不如民间跳大神的",2026-02-28T05:33:28.187246Z,original,133
5623,1,0.8005539973576864,1,2026-02-28T05:33:28.187229Z,0,16323,12.166,2/1,uncertain_or_low_confidence,"……古代那些传教士，自己贴钱都要去传教，比如！？明末清朝那些耶！稣会，自己建修会，自！己也出钱，还、自己让自己听教皇指挥
儒家？有！几个免费教人子弟识字的？。
道士？道士辩；经的平均能力可能不如民间跳大神·的",2026-02-28T05:33:28.187246Z,original_AEDA,133
5623,1,0.8005539973576864,1,2026-02-28T05:33:28.187229Z,0,16323,12.166,2/1,uncertain_or_low_confidence,"古代传教士甚至自掏腰包传教。比如明末清初的耶稣会士，建立自己的修会，捐献自己的钱财，甚至服从教皇的命令。
儒生呢？他们有几个免费教人子弟读书的？
道士呢？道士们辩经的平均能力可能还不如民间巫医。",2026-02-28T05:33:28.187246Z,BT_Gemini_Sim0.93,133
5623,1,0.8005539973576864,1,2026-02-28T05:33:28.187229Z,0,16323,12.166,2/1,uncertain_or_low_confidence,"古代传教！士甚至自掏……腰？包传教。比如明末清·初的耶稣会士，建立自己的修会，、捐献自己。的钱财，甚至服从教皇的命令。
儒生呢？他们有？几个。免费？教人子弟读书的？
道士呢？道士们辩经的平均能力可能还不如民间巫医。",2026-02-28T05:33:28.187246Z,BT_AEDA,133
6976,1,0.725797971089681,1,2026-03-19T11:43:49.713098Z,1,16256,61.336,1/2,uncertain_or_low_confidence,看到（做礼拜），我感觉已经没戏了，如果你不是基督徒的话，基督的世界异常凌乱。,2026-03-19T11:43:49.713126Z,original,151
6976,1,0.725797971089681,1,2026-03-19T11:43:49.713098Z,1,16256,61.336,1/2,uncertain_or_low_confidence,看到（做礼拜），我感觉已经没戏了，如果你不是基督徒的话，基督的世界，！异。常凌乱。。,2026-03-19T11:43:49.713126Z,original_AEDA,151
6976,1,0.725797971089681,1,2026-03-19T11:43:49.713098Z,1,16256,61.336,1/2,uncertain_or_low_confidence,看到（礼拜），我觉得已经没希望了。如果你不是基督徒，基督教世界异常混乱。,2026-03-19T11:43:49.713126Z,BT_Gemini_Sim0.92,151
6976,1,0.725797971089681,1,2026-03-19T11:43:49.713098Z,1,16256,61.336,1/2,uncertain_or_low_confidence,看到（礼拜），我觉得已经没；希望了·。如果；你不是基督徒，基督教世界异常混乱。,2026-03-19T11:43:49.713126Z,BT_AEDA,151
5562,1,0.8014757831891378,1,2026-02-28T01:53:59.860329Z,0,16953,9.113,1/2,uncertain_or_low_confidence,绝不放弃，死磕，直到上帝的公义彰显。 //@汉青赵颖://@代老师和他的山区孩子: #视角#正义迟来总比永远不来好! //@女童保护:#女童保护#【纽约警察22年为遇害女童伸张正义】感动！我们也需要这样的坚持和善良，“因为我们在乎”！,2026-02-28T01:53:59.860348Z,original,149
5562,1,0.8014757831891378,1,2026-02-28T01:53:59.860329Z,0,16953,9.113,1/2,uncertain_or_low_confidence,绝不，放弃，死磕，直到上帝的公；，义彰显。 //？@汉青赵。颖://@代。老！·师和他的山区孩子: #视角#正义！迟来总比；永远不来好! //@女·、童保护:#女童保；护#【纽约。警察22年为遇害女童伸张？正义】感动！我们也需要！这样的坚持和善良，“因为我们在乎”！,2026-02-28T01:53:59.860348Z,original_AEDA,149
692,1,0.7666923999786377,1,2026-02-02T12:49:21.548874Z,0,16996,4.055,1/2,uncertain_or_low_confidence,刚才@旅游卫视官方微博 的?行者?，我看到你被钉在了十字架上，十指穿心，你说行者就是修行者，这就是你一直坚持的信仰吗？问候你！给在十字架上的你敬个礼！周末愉快亲爱的朋友！旅途愉快！@眭�平,2026-02-02T12:49:21.548888Z,original,144
692,1,0.7666923999786377,1,2026-02-02T12:49:21.548874Z,0,16996,4.055,1/2,uncertain_or_low_confidence,刚才@旅游？卫视官。方。微博 的?行者?，我看到你被钉在了十字架。上，十指穿心，你说行者就是修、行者，这·就是你一直坚持的？信仰吗？问候、你！，给在十字架上的你敬个；礼！周末愉快亲爱、的朋友、！旅途愉快！@眭�平,2026-02-02T12:49:21.548888Z,original_AEDA,144
692,1,0.7666923999786377,1,2026-02-02T12:49:21.548874Z,0,16996,4.055,1/2,uncertain_or_low_confidence,刚才，在@旅游卫视官方微博 的《行者》中，我看到你被钉在十字架上，十指穿心。你说行者是修行者——这是你一直秉持的信仰吗？我向你致敬！向十字架上的你致敬！周末愉快，亲爱的朋友！旅途愉快！@隋建平,2026-02-02T12:49:21.548888Z,BT_Gemini_Sim0.98,144
692,1,0.7666923999786377,1,2026-02-02T12:49:21.548874Z,0,16996,4.055,1/2,uncertain_or_low_confidence,刚才，在·@旅游卫、视官、方微博 的《行者》中，我看到你被钉在、十字架·上，十指穿心。你说行者是修行者——这是你；一直秉持的信仰吗？我，向你致敬！向十字架上的你致敬！周末愉……快，……亲爱的朋友！旅途愉快！@隋！建平,2026-02-02T12:49:21.548888Z,BT_AEDA,144
775,1,0.757910152276357,1,2026-02-02T12:55:20.437505Z,1,18413,2.222,1/2,uncertain_or_low_confidence,有没有考虑过，耶稣会不如不发酵,2026-02-02T12:55:20.437525Z,original,134
775,1,0.757910152276357,1,2026-02-02T12:55:20.437505Z,1,18413,2.222,1/2,uncertain_or_low_confidence,有没有考虑过，耶稣会不如不·发酵,2026-02-02T12:55:20.437525Z,original_AEDA,134
775,1,0.757910152276357,1,2026-02-02T12:55:20.437505Z,1,18413,2.222,1/2,uncertain_or_low_confidence,你有没有想过，耶稣会士不再煽动会更好？,2026-02-02T12:55:20.437525Z,BT_Gemini_Sim0.83,134
775,1,0.757910152276357,1,2026-02-02T12:55:20.437505Z,1,18413,2.222,1/2,uncertain_or_low_confidence,你有没有想，过，耶稣会士不，再煽动会更好？,2026-02-02T12:55:20.437525Z,BT_AEDA,134
3509,1,0.7565357089042664,1,2026-02-15T13:11:32.788677Z,0,18679,35.299,1/2,uncertain_or_low_confidence,美到令人不敢相信的中世纪小尼姑，眼微微地垂下。手中高高擎起一支点亮的长烛。简单静穆，直像一张宗教画！林徽音，《钟绿》。希腊姑娘。死在一艘帆船上。,2026-02-15T13:11:32.788718Z,original,154
3509,1,0.7565357089042664,1,2026-02-15T13:11:32.788677Z,0,18679,35.299,1/2,uncertain_or_low_confidence,美到令人不敢相信的！……中。世纪小尼姑，眼微微地垂下。手中高高擎？起一支点亮的长烛。简单静穆；；，直像一张宗、教画！林徽音，《钟绿》。希腊姑；娘。、死在一艘帆……船上。,2026-02-15T13:11:32.788718Z,original_AEDA,154
3509,1,0.7565357089042664,1,2026-02-15T13:11:32.788677Z,0,18679,35.299,1/2,uncertain_or_low_confidence,一位美得令人难以置信的中世纪小修女，她微垂着眼。她手里高举着一支点燃的长蜡烛。质朴而宁静，就像一幅宗教画！林徽因，钟吕。希腊女孩。死于帆船上。,2026-02-15T13:11:32.788718Z,BT_Gemini_Sim0.95,154
3509,1,0.7565357089042664,1,2026-02-15T13:11:32.788677Z,0,18679,35.299,1/2,uncertain_or_low_confidence,一位美得令人难以置信的。；中，世纪小修，女，她微垂着眼。她手……里高举着一支点燃的长蜡烛。质朴而……宁静，就像一幅。宗教画！林徽因，钟吕？。希腊女孩。死于帆船上。,2026-02-15T13:11:32.788718Z,BT_AEDA,154
780,1,0.8291970690091451,1,2026-02-02T12:55:37.395627Z,0,18569,3.458,2/1,uncertain_or_low_confidence,教会传统婚姻誓辞，常常莫名其妙的打动人。因为在人生光华的焦点，牧师在新人面前，囊括了人生基本的几大苦难。婚约若非成立在信心中，听起来实在晦气。若成立在信心中，这誓辞的意思就是，只要死亡尚未将你们分开，就不要浪费你的衰老，不要浪费你的疾病，不要浪费你的贫穷。,2026-02-02T12:55:37.395647Z,original,142
780,1,0.8291970690091451,1,2026-02-02T12:55:37.395627Z,0,18569,3.458,2/1,uncertain_or_low_confidence,教会……传统婚姻·誓辞，常常莫名其妙的打动人。因为在人生光华的焦·点；、，牧师在新人面前，囊括了人生，基，本的几大苦难。婚约若非成立在信心中，听起来实在晦气，？。若成立在信心中，这誓辞的意思、就是，？只……？要死亡尚未将你们分开，就不要浪费你的衰老，不·要浪；费你的疾病，不要浪！费你的贫穷·。；,2026-02-02T12:55:37.395647Z,original_AEDA,142
780,1,0.8291970690091451,1,2026-02-02T12:55:37.395627Z,0,18569,3.458,2/1,uncertain_or_low_confidence,传统的教堂婚礼誓词常常莫名地打动人心。这是因为，在生命最辉煌的焦点上，牧师在新人面前，涵盖了生命最基本的重大苦难。如果婚姻盟约不是建立在信仰之上，它听起来确实不祥。如果建立在信仰之上，这些誓词的意义是：只要死亡尚未将你们分开，就不要浪费你的老年，不要浪费你的疾病，不要浪费你的贫穷。,2026-02-02T12:55:37.395647Z,BT_Gemini_Sim0.95,142
780,1,0.8291970690091451,1,2026-02-02T12:55:37.395627Z,0,18569,3.458,2/1,uncertain_or_low_confidence,传统的教。堂婚礼。誓词常·常莫名地打动……人。！心。这是因为，在生命最辉煌的焦点上，牧师在新人面前，涵盖了生命最基本。的重大苦难。……，如果。婚姻盟约不是建立？在信仰之；上，它？听起、来，……确实不祥。如果建立在信仰之上，这些誓词的意？义是：只要死亡尚未。将你们分开，就不、要浪费你的老年？，不要浪费你的疾病，不要浪；费你的贫穷。,2026-02-02T12:55:37.395647Z,BT_AEDA,142
385,1,0.8138675292332967,1,2026-02-02T11:48:30.000081Z,0,16516,2.074,1/2,uncertain_or_low_confidence,读圣经、祷告、聚会，与上帝建立关系是重要的提升。但是同时，基督徒应该有一份脚踏实地的工作，一个实实在在的专业，认真钻研一个行业。丰富的经历经验人生，否则人们看到的基督徒就永远都是一群游手好闲的人了，这些绝对不是好见证。如果你无法专心致志的从事一项事业，那么信仰就太脆弱了。,2026-02-02T11:48:30.000106Z,original,141
385,1,0.8138675292332967,1,2026-02-02T11:48:30.000081Z,0,16516,2.074,1/2,uncertain_or_low_confidence,读圣经、祷告、聚会，？与；上帝建立关系是。重要的提升。但是同。时，基督徒应该有一份，脚踏实地的工作，一个实实在在的专。业、，认真钻研一个行·业。丰富的经历经验！人生，、否则人们看到的基督，徒就永远都是一群、游手好闲的！人了，这些！绝对不是好见证。如、？果你无法专！心致志的从事一项事业？，那么信仰就太！脆弱了。·,2026-02-02T11:48:30.000106Z,original_AEDA,141
385,1,0.8138675292332967,1,2026-02-02T11:48:30.000081Z,0,16516,2.074,1/2,uncertain_or_low_confidence,读圣经、祷告、参加聚会、与神建立关系是重要的提升。但与此同时，基督徒应该有一份脚踏实地的工作，一份实实在在的职业，并努力深耕一个行业。拥有丰富的人生阅历，否则人们看到的基督徒永远是一群游手好闲之徒，而这些绝不是好的见证。如果你不能全心全意地追求事业，那么你的信仰就太脆弱了。,2026-02-02T11:48:30.000106Z,BT_Gemini_Sim0.98,141
