index,original,en_intermediate,back_translated
196,>>132 普通に国立大卒だが、それがどうした？ まあ、お前が仮に東大出でも、聖書コピペスレにノコノコ出て来て裏天皇裏天皇とバカの一つ覚えの繰り言垂れてる時点で、お前が「学歴バカ」ガイジなのが露呈するだけだがwwww,">>132 I'm just a national university graduate, so what? Well, even if you graduated from Todai, the moment you shamelessly show up in a Bible copypasta thread and keep spouting Hidden Emperor, Hidden Emperor like a fool with one trick, it just exposes that you're an academic background idiot retard hahahaha.",>>132 ただの国立大卒だけど、だから何？まあ、東大卒だろうが、聖書コピペスレに恥も外聞もなく現れて、一発芸人みたいに隠れ帝王、隠れ帝王と連呼してる時点で、お前が学歴だけの低能馬鹿だと露呈するだけなんだよｗｗｗｗｗ
205,「あなたは高価な者」マタイ8：28-34 : 国立のぞみ教会説教要約 by nozomichurch | 2010-05-16 10:30 | マタイ福音書 << 「出発信仰」使徒言行録1：12... 「イエスの示す道」マタイ8：1... >>,You Are a Precious One Matthew 8:28-34 : National Nozomi Church Sermon Summary by nozomichurch | 2010-05-16 10:30 | Gospel of Matthew << Departure Faith Acts 1:12... The Path Jesus Shows Matthew 8:1... >>,あなたは尊い者です マタイによる福音書 8:28-34 : 国立のぞみ教会 説教要約 nozomichurchによる | 2010-05-16 10:30 | マタイによる福音書 << 出発の信仰 使徒の働き 1:12... イエスが示される道 マタイによる福音書 8:1... >>
207,義なる太陽が全地を照らした「聖い王国が現れた」 | 神の国降臨の福音 歌とダンスの動画 1132,The righteous sun illuminated the whole earth A holy kingdom appeared | Gospel of the Advent of God's Kingdom Song and Dance Video 1132,義の太陽が全地を照らした 聖なる国が現れた | 神の国の到来の福音 歌と踊りのビデオ 1132
206,キリスト教の超越的な神とIntercessory Prayer: 忘却からの帰還 << 創造論者が誤る理由 | TOP | 創造論な目的論 >>,The Transcendent God of Christianity and Intercessory Prayer: Return from Oblivion << Why Creationists Err | TOP | Creationist Teleology >>,キリスト教の超越神と執り成しの祈り：忘却からの帰還 << 創造論者がなぜ誤るのか | TOP | 創造論的テオロジー >>
203,"聖書信仰（藤本満師ゲスト投稿　その２）	2015年12月12日 / theophilus1970	藤本満先生によるゲスト投稿の第2回です。第1回目の投稿はこちらです。 ゲスト投稿, 福音主義, 聖書, 書籍紹介	神学者福音主義聖霊聖書	投稿ナビゲーション ← 聖書信仰（藤本満師ゲスト投稿　その１）Even Saints Get the Blues（信仰者と嘆きの歌）（1） →	聖書、神学、その他の随想","Biblical Faith (Guest Post by Pastor Mitsuru Fujimoto, Part 2)
December 12, 2015 / theophilus1970
This is the second installment of the guest post by Mr. Mitsuru Fujimoto. The first post is here.
Guest Post, Evangelicalism, Bible, Book Introduction
Theologian, Evangelicalism, Holy Spirit, Bible
Post Navigation ← Biblical Faith (Guest Post by Pastor Mitsuru Fujimoto, Part 1) Even Saints Get the Blues (Believers and Songs of Lament) (1) →
Bible, Theology, and Other Essays","聖書的信仰（藤本満牧師による寄稿、その２）
2015年12月12日 / theophilus1970
藤本満氏による寄稿の第二回です。最初の投稿はこちら。
寄稿、福音主義、聖書、書籍紹介
神学者、福音主義、聖霊、聖書
投稿ナビゲーション ← 聖書的信仰（藤本満牧師による寄稿、その１） 聖徒も憂鬱になる時（信徒と嘆きの歌）(1) →
聖書、神学、その他エッセイ"
208,・「使徒的勧告『Christus vivit』は若者と召命司牧の”マグナ・カルタ”になる」ー発表受けた記者会見で | カトリック・あい ← ・教皇、若者テーマのシノドス受けた使徒的勧告「クリストゥス・ヴィヴィト」発表 ・バチカン国務長官、中国との暫定合意批判に「忍耐が必要」（CRUX) →,・The Apostolic Exhortation 'Christus vivit' will become the 'Magna Carta' for youth and vocational pastoral care —at the press conference following the announcement | Catholic Ai ← ・Pope announces Apostolic Exhortation 'Christus vivit' following the Synod on youth ・Vatican Secretary of State: 'Patience is needed' regarding criticism of the provisional agreement with China (CRUX) →,"・使徒的勧告「キリストは生きている」は青少年と召命司牧の「マグナ・カルタ」となるだろう —発表後の記者会見で | カトリックAi ←
・教皇、青少年に関するシノドスを受けて使徒的勧告「キリストは生きている」を発表
・バチカン国務長官、中国との暫定合意への批判に関して「忍耐が必要だ」 (CRUX) →"
212,トマス（漫画︰聖☆おにいさん）- マンガペディア イエスに仕える十二使徒の1人で壮年の男性。かつてイエスが復活を果たした際、その素性を疑い、聖痕に手を入れて確かめたという逸話が残されている。堅物で非常に疑り深く、すべてにおいて自分で確かめたものでなければ信用しない。イエスの聖痕に手を突っ込んだ逸話は仲間内でもたびたびネタにされており、またブッダと初対面の際にはその立派な耳たぶが本物かを疑い、引っ張った過去もある。 実在の人物、使徒トマスがモデル。,"Thomas (Manga: Saint Young Men) - Mangapedia
He is a middle-aged man, one of the twelve apostles serving Jesus. An anecdote remains that when Jesus achieved resurrection, he doubted his identity and put his hand into the stigmata to confirm it. He is a straight-laced and extremely skeptical person, who will not believe anything unless he has confirmed it himself. The anecdote of him sticking his hand into Jesus' stigmata is often made fun of among his companions, and he also has a past of pulling Buddha's magnificent earlobes when they first met, doubting if they were real. The real-life figure, Apostle Thomas, is the model.","トーマス (漫画: 聖☆おにいさん) - マンガペディア
彼はイエスに仕える十二使徒の一人である中年男性。イエスが復活を遂げた際、その正体を疑い、確認のために聖痕に手を入れたという逸話が残っている。生真面目で極度の懐疑主義者であり、自分で確認しない限り何も信じない。イエスの聖痕に手を入れた逸話は仲間内でよくネタにされており、ブッダと初めて会った際も、その立派な耳たぶが本物かどうか疑って引っ張った過去がある。実在の人物である使徒トマスがモデル。"
209,>>718 いや5chでは昔から壺三って言ってたから 事件後すぐに統一教会と安倍の癒着が拡散されたよ,">>718 No, on 5ch, they had been calling him Pot-Abe for a long time, so immediately after the incident, the collusion between the Unification Church and Abe was spread.",>>718 いいえ、5ちゃんねるでは、ずっと「壺安倍」と呼んでいたので、事件直後から、統一教会と安倍の癒着が広まった。
216,聖書とはどんな書物なのですか？ 21ビュー 福音自由教会とは 15ビュー 子ども祝福式が行われました 14ビュー © 古川福音自由教会 2017,"What kind of book is the Bible? 21 views
What is the Evangelical Free Church? 15 views
A Children's Blessing Ceremony was held. 14 views
© Furukawa Evangelical Free Church 2017","聖書はどんな本ですか？ 21ビュー
福音自由教会とは？ 15ビュー
子供祝福式が行われました。 14ビュー
© 古川福音自由教会 2017"
214,イエス・キリストが道です ～村上宣道牧師のメッセージ - 日本CGNTV :: 世界のための福音の通路 hit 90 recomend 17 2018-09-20 11:32:27 ｢イエスは彼に言われた。『わたしが道であり、真理であり、いのちなのです。わたしを通してでなければ、だれひとり父のみもとに来ることはありません』｣（ヨハ 14:6）。これは、イエスご自身の自己紹介です。私はこの中の「道」ということについてお話したいと思います。 43 49 49 84 認証キーを入力してください,"Jesus Christ is the Way ~Message from Pastor Nobumichi Murakami - Japan CGNTV :: Gospel Channel for the World hit 90 recomend 17 2018-09-20 11:32:27 Jesus said to him, 'I am the way, and the truth, and the life. No one comes to the Father except through me.' (John 14:6). This is Jesus' own self-introduction. I would like to talk about the Way within this. 43 49 49 84 Please enter authentication key","イエス・キリストこそ道～村上宣道牧師からのメッセージ - 日本CGNTV :: 世界のための福音チャンネル
再生回数90 おすすめ17 2018-09-20 11:32:27
イエスは彼に言われた、「わたしが道であり、真理であり、いのちである。だれもわたしによらないでは、父のみもとに行くことはできない。」（ヨハネによる福音書14章6節）。これはイエスご自身の自己紹介です。この中で「道」についてお話ししたいと思います。
43 49 49 84 認証キーを入力してください"
213,私たちの帰る場所 | デイリーブレッド公式サイト 聖書のみことば: エペソ3:14-21 | 一年で聖書を: 民数記1-3 ; マルコ3 神よ、イエスに帰属していることを感謝します。今から永遠まで、希望の人生をくださり、ありがとうございます。 トピック: デイリーブレッド 失望 希望,"Our Home | Daily Bread Official Website
Scripture: Ephesians 3:14-21 | Bible in a Year: Numbers 1-3; Mark 3
God, I thank You for belonging to Jesus. Thank You for giving me a life of hope from now until eternity.
Topic: Daily Bread Disappointment Hope","ホーム | 日ごとの糧 公式ウェブサイト
聖書箇所: エペソ人への手紙 3章14-21節 | 一年で読む聖書: 民数記 1-3章、マルコの福音書 3章
神様、イエス様に属していることを感謝します。今から永遠にわたる希望の人生を与えてくださり、ありがとうございます。
テーマ: 日ごとの糧 落胆 希望"
211,真のお父様に帰ろう！『三代王権・こころのサンクチュアリ教会』: １１月２９日「自由と責任」文亨進師　【英語説教日本語訳】,Let's return to True Father! Third Generation Kingship - Sanctuary Church of the Heart: November 29th Freedom and Responsibility Pastor Hyung Jin Moon [Japanese Translation of English Sermon],真のお父様のもとに戻りましょう！第三代王権・心の聖所教会：11月29日 自由と責任 文亨進牧師 [英語説教の日本語訳]
215,心のオアシス: 聖書研究「安息日」 投稿者 聖書研究　プロートトコス 時刻: 16:43 安息日の意義 キーノート：「それだから、神の安息にはいるべき約束が、まだ存続しているにかかわらず、万...,"Heart's Oasis: Bible Study Sabbath
Poster: Bible Study Prototokos
Time: 16:43
Significance of the Sabbath
Keynote: Therefore, even though the promise to enter God's rest still remains, all...","心のオアシス：聖書研究安息日
ポスター：聖書研究プロトトコス
時刻：16時43分
安息日の意義
要点：したがって、神の安息に入る約束はまだ残っているにもかかわらず、すべての者たちは..."
210,教会とか社寺とかに行くのは素晴らしいと思います。 というか、私はそれがないとやってられないというか、坐禅が恋しくなります。,"I think it's wonderful to go to churches, shrines, temples, and so on. Or rather, I mean, I can't get by without that, or rather, I miss zazen.",教会、神社、お寺などに行くのは素晴らしいことだと思います。というより、というか、それがないとやっていけないというか、座禅が恋しいんです。
202,分派（プロテスタント）の秘跡が無効のまとめ 秘跡の権能を有するのは司祭と司教にだけ許されている。 司祭の権能は当人一代限りで他者へ与えることは出来ない。 秘跡の権能を他者へ与えられる権能は使徒たちの継承者である司教のみ。 司教は司教と司祭を生み出せる。（権能を他者へ与えられるという意味） 秘跡の権能を与えられたカトリック司祭は還俗しても改宗しても権能は霊的に保持したまま。 トリエント公会議でプロテスタントの洗礼が有効とされたのは元カトリック司祭のプロテスタント牧師が多い時代だったから。 ローマ聖座が現代のプロテスタントの秘跡を有効と判断した事実は無い。 21世紀の現代でもカトリックとプロテスタントで対話が続いてる。ソースはキリスト教系のニュース。 現代の日本ではプロテスタントがカトリックに改宗する際には堅信の秘跡を受けさせる。（実質的には再洗礼） もしもプロテスタントの洗礼が有効ならばそのまま移籍できるはずである。 カトリックの教理を認めていない状態でのプロテスタントでの洗礼は信仰宣言的にも霊的にも無効である。 西方教会（ローマカトリック）は東方教会の秘跡は有効としている。,"Summary: Sacraments of schismatic groups (Protestants) are invalid.

Only priests and bishops are permitted to possess the authority of the sacraments. The authority of a priest is limited to that individual's lifetime and cannot be conferred upon others. Only bishops, who are the successors of the apostles, possess the authority to confer the authority of the sacraments upon others. Bishops can create bishops and priests (meaning they can confer authority upon others). Catholic priests who have been conferred the authority of the sacraments retain that authority spiritually, even if they return to secular life or convert.

The reason Protestant baptism was deemed valid at the Council of Trent was because it was an era when there were many Protestant pastors who were former Catholic priests. There is no fact that the Holy See of Rome has judged modern Protestant sacraments as valid. Even in the modern 21st century, dialogue continues between Catholics and Protestants. The source is Christian-related news.

In modern Japan, when Protestants convert to Catholicism, they are made to receive the sacrament of Confirmation (effectively, re-baptism). If Protestant baptism were valid, they should be able to transfer directly. Baptism in Protestantism, when not recognizing Catholic doctrine, is invalid both declaratively of faith and spiritually. The Western Church (Roman Catholic) considers the sacraments of the Eastern Church valid.","概要：離教集団（プロテスタント）の秘跡は無効である。

司祭と司教のみが秘跡の権能を保持することを許されている。司祭の権能はその個人の生涯に限定され、他者に授与することはできない。使徒の後継者である司教のみが、他者に秘跡の権能を授与する権能を保持している。司教は司教や司祭を叙階できる（つまり、他者に権能を授与できる）。秘跡の権能を授与されたカトリック司祭は、還俗したり改宗したりしても、その権能を霊的に保持する。

トリエント公会議でプロテスタントの洗礼が有効とされた理由は、元カトリック司祭であったプロテスタントの牧師が多数存在した時代だったからである。ローマ教皇庁が現代のプロテスタントの秘跡を有効と判断したという事実はない。現代の21世紀においても、カトリックとプロテスタントの間で対話が続いている。出典はキリスト教関連のニュース。

現代の日本において、プロテスタントがカトリックに改宗する際、堅信の秘跡を受けさせられる（実質的に、再洗礼）。もしプロテスタントの洗礼が有効であれば、直接転籍できるはずである。プロテスタントにおける洗礼は、カトリックの教義を認識しない場合、信仰の宣言としても霊的にも無効である。西方教会（ローマ・カトリック）は、東方教会の秘跡を有効とみなしている。"
222,涼しくなったら コロナの心配もないので 教会礼拝久しぶりに行くかも 再来週かな？,"When it gets cooler, since there's no worry about corona, I might go to church service for the first time in a while. Maybe the week after next?",涼しくなったら、コロナの心配がないから、久しぶりに教会の礼拝に行こうかな。再来週くらいかな？
219,終わりのときのリバイバル: Eirene 〜 平和 〜 （CVSAブログ） << 『キリストの花嫁 １１』雅歌 8:5-14 | TOP | 「信仰」という名の虐待 Part1 「普通の教会が『カルト』化する現象が増えてきている」 >> 「信仰」という名の虐待 Part9【最終..,Revival in the End Times: Eirene ~ Peace ~ (CVSA Blog) << The Bride of Christ 11 Song of Solomon 8:5-14 | TOP | Abuse in the Name of 'Faith' Part1 'The phenomenon of ordinary churches becoming 'cults' is increasing' >> Abuse in the Name of 'Faith' Part9 [Final..,終末のリバイバル：エイレーネー ～平和～ (CVSAブログ) << キリストの花嫁 11 雅歌 8:5-14 | TOP | 「信仰」の名における虐待 Part1 「一般の教会が『カルト』化する現象が増加している」 >> 「信仰」の名における虐待 Part9 [最終回..
218,>>18 どうでも良いけどね キリスト者の目的は邪悪なる悪霊の栖雲居士を 撃ち破る事ではありません。又それで神の栄光 が現れるわけでもありません。 何を言っているんですか、スレ乱立の責任を取っ てね,">>18 It doesn't really matter, but the purpose of Christians is not to defeat Seiun Koji, the evil demon. Nor will God's glory be revealed by that. What are you talking about? Take responsibility for the thread spamming.",>>18 別にどうでもいいけど、キリスト教徒の目的は、悪魔であるセイウンコージを倒すことではない。それによって神の栄光が示されることもない。何を言ってるんだお前は？スレを荒らした責任を取れ。
221,« ５月の行事・礼拝予定 | トップページ | 教会の学びの場 » 2017年5月 1日 (月) ３．牧師より | 固定リンク http://app.f.cocolog-nifty.com/t/trackback/1178117/70373743,"« May's Events/Worship Schedule | Top Page | Church Learning Space » May 1, 2017 (Mon) 3. From the Pastor | Permalink http://app.f.cocolog-nifty.com/t/trackback/1178117/70373743",« 5月のイベント・礼拝スケジュール | トップページ | 教会学習スペース » 2017年5月1日 (月) 3. 牧師より | パーマリンク http://app.f.cocolog-nifty.com/t/trackback/1178117/70373743
226,イエスの時代の陰謀と現代の陰謀：陰謀に怯えるべきでない根拠: 雲の柱・火の柱　アウトロー神学者の終末世相診断 << ケムトレイルの内部告発動画 | TOP | ペットは死後どうなるのか >> なかなか説得力のある記事ですね。 Posted by 大和の苫屋 at 2010年08月01日 22:38 お久しぶりです。有り難うございます。栄光在主。 Posted by モトイ at 2010年08月02日 06:48,"Conspiracies in the time of Jesus and Modern Conspiracies: Reasons Why You Should Not Be Afraid of Conspiracies: Pillar of Cloud, Pillar of Fire - Outlaw Theologian's Diagnosis of End-Time Social Conditions << Chemtrail Whistleblower Video | TOP | What Happens to Pets After Death? >> This is quite a persuasive article. Posted by Yamato no Tomaya at August 1, 2010 22:38 Long time no see. Thank you very much. Glory to the Lord. Posted by Motoi at August 2, 2010 06:48","イエス時代の陰謀と現代の陰謀：陰謀を恐れるべきでない理由：雲の柱、火の柱 - アウトロー神学者の終末社会診断
<< ケムトレイル内部告発ビデオ | TOP | ペットは死後どうなる？ >>
これはなかなか説得力のある記事ですね。
投稿者：大和のともや 2010年8月1日 22:38
ご無沙汰しております。誠にありがとうございます。主に栄光あれ。
投稿者：元井 2010年8月2日 06:48"
225,「わたしはあなたと争う者と争い、あなたの子らを救う。」―神の約束は、ことごとくこの方において「然り」となった。: 私ではなくキリスト（東洋からの風の便り） « 新エルサレムまで続く長く細い道のりを、主が出会わせて下さった兄弟姉妹と共に辿りつつ | トップページ | 主の目は正しい人をかえりみ、その耳は彼らの叫びに傾く。正しい者が助けを叫び求めるとき、主は聞いて、彼らをそのすべての悩みから助け出される。 » 2018年8月11日 (土) 義人は信仰によって生きる | 固定リンク,"I will contend with those who contend with you, and I will save your children. —All of God's promises became Yes in Him. : Not I, but Christ (Tidings from the East) « While walking along the long and narrow path leading to New Jerusalem, together with the brothers and sisters whom the Lord brought us together with | Top Page | The Lord's eyes look upon the righteous, and His ears incline to their cry. When the righteous cry out for help, the Lord hears and delivers them from all their troubles. » August 11, 2018 (Sat) The righteous live by faith | Permalink",あなたと争う者と私は争い、あなたの子らを救う。—神のすべての約束は、彼において「はい」となった。: 私ではなく、キリスト (東からの知らせ) « 主が私たちを共に集めてくださった兄弟姉妹と共に、新エルサレムへと続く長く狭い道を歩みながら | トップページ | 主の目は義人を見守り、その耳は彼らの叫びに傾く。義人が助けを求めて叫ぶとき、主は聞き、彼らをすべての苦難から救い出す。 » 2018年8月11日(土) 義人は信仰によって生きる | パーマリンク
217,ヴィパッサナー瞑想 : no Trip no Photo 光の教会 日本の教会もいいです... by noTnoP | 2012-03-04 10:00 | 世界一周 << 自由 僧満載 >>,Vipassana Meditation : no Trip no Photo Church of Light Japanese churches are also good... by noTnoP | 2012-03-04 10:00 | World Tour << Packed with Free Monks >>,ヴィパッサナー瞑想：旅なし写真なし 光の教会 日本の教会も良い... by noTnoP | 2012-03-04 10:00 | ワールドツアー << 自由な坊主満載 >>
224,11世紀まで：東西教会の差異拡大編集 1054年：教皇と総主教の相互破門編集 1054年から15世紀まで・十字軍編集 フィレンツェ公会議での東西教会合同不成立編集 近現代における差異の拡大と対立編集 近代以降：和解への道のり編集 「相互破門」の解消編集 東西教会両首脳が同席した聖体礼儀編集 東西教会分裂の現状編集 「分裂とは何か」「和解とは何か」の問題編集 現況：緊張持続と緊張緩和編集 最終更新: 2018年8月4日 (土) 19:05,"Until the 11th century: Widening of differences between the East and West Churches
1054: Mutual excommunication of the Pope and the Patriarch
From 1054 to the 15th century: The Crusades
Failure of East-West Church union at the Council of Florence
Expansion of differences and conflict in modern and contemporary times
Since modern times: Path to reconciliation
Resolution of the mutual excommunication
Eucharistic liturgy attended by both leaders of the East and West Churches
Current state of the East-West Church schism
The problem of What is schism? and What is reconciliation?
Current situation: Sustained tension and easing of tension
Last updated: August 4, 2018 (Sat) 19:05","11世紀まで：東西教会間の差異の拡大
1054年：教皇と総主教の相互破門
1054年から15世紀まで：十字軍
フィレンツェ公会議での東西教会一致の失敗
近現代における差異と対立の拡大
近代以降：和解への道
相互破門の解消
東西教会の両指導者による聖体礼儀への列席
東西教会分裂の現状
「分裂とは何か？」「和解とは何か？」という問題
現状：緊張の持続と緩和
最終更新：2018年8月4日（土）19:05"
