index,original,en_intermediate,back_translated
8,讃美歌　終わりの日における神の警告「人類が神を礼拝すれば人々は幸運を得ることができる」 | 神の国降臨の福音 讃美歌動画 1480,"Hymn: God's Warning in the Last Days If mankind worships God, people can obtain good fortune | The Gospel of the Advent of God's Kingdom Hymn Video 1480",賛美歌：終わりの日の神の警告 人類が神を崇拝すれば、人々は幸運を得られる ｜ 神の国の到来の福音 賛美歌ビデオ1480
7,霊的な宴 | 福音の村 タグ: 霊的な宴	一緒にご飯を食べなさい	【カトリック上野教会】,Spiritual Feast | Gospel Village Tag: Spiritual Feast Eat a meal together [Ueno Catholic Church],霊的饗宴 | 福音の村 タグ: 霊的饗宴 食事を共にする [上野カトリック教会]
4,統一教会は反日カルトだよ だから保守だ愛国だでバカをだます そして金は北朝鮮に送っていた つまり北朝鮮の組織なんだよ,"The Unification Church is an anti-Japanese cult. That's why they deceive idiots with 'conservative' and 'patriotic' talk. And they were sending money to North Korea. In other words, it's a North Korean organization.",統一教会は反日カルトだ。だから、「保守」や「愛国」の言葉で馬鹿を騙す。しかも、北朝鮮に金を送っていた。要するに、北朝鮮の組織だ。
1,>>802 お前は日本教の信仰に従って勝手に他の宗教の神を日本教の支配下にしてバカにしてるだろ。 全世界の仏教徒に謝れよ。,">>802 You, following the faith of Nihonkyo, are presumptuously placing the gods of other religions under the control of Nihonkyo and ridiculing them, aren't you? Apologize to all the Buddhists in the world.",>>802 日本教の信仰に従うお前は、他の宗教の神々を日本教の支配下に置いていると傲慢にも決めつけ、嘲笑しているのだろう？世界中の仏教徒に謝罪しろ。
5,第五十六章 | 全能神教会 あなたがたは神の言葉をもって自らを装備するよう言われているが、あなたがたのために何が采配されようが、すべては神が自らの手で指揮するものであるから、あなたがたの熱心な祈りや嘆願は必要ではない──それらは役に立たないのである。しかし、現在の状況から見れば、あなたがたの直面する実際の問題は、あなたがたには…,"Chapter 56 | The Church of Almighty God
You are told to equip yourselves with the word of God, but whatever may be arranged for you, all of it is directed by God with His own hands, so your fervent prayers and supplications are not necessary—they are useless. However, looking at the current situation, the actual problems you face, for you...","第56章 | 全能神教会
あなた方は神の言葉で身を固めるように言われているが、あなた方に何が手配されようとも、そのすべては神ご自身の手によって導かれているので、あなた方の熱心な祈りや嘆願は必要ない――それらは無益である。しかし、現状を見ると、あなた方が直面している実際の問題、あなた方には…"
3,現実性に一層重点を置くこと | 神の国降臨の福音 律法の時代における働き 全能者のため息 終わりの日のキリストだけが人に永遠のいのちの道を与えられる 終着点のために、善行を十分積まなければならない,"Placing even more emphasis on reality | The Gospel of the Advent of the Kingdom of God The Work in the Age of Law The Sigh of the Almighty Only Christ of the Last Days can give people the way of eternal life For the final destination, one must accumulate enough good deeds.",さらに現実に重点を置く ｜ 神の国の降臨の福音 律法の時代における御業 全能者の嘆息 終わりの日のキリストのみが人々に永遠の命の道を与えることができる 最終的な目的地のためには、十分な善行を積み重ねなければならない。
9,朗読　主イエスの再臨の御言葉 「神の働き、神の性質、そして神自身 ２」 その１　パート１ | 全能神教会,"Recitation: The Word of the Second Coming of the Lord Jesus God's Work, God's Nature, and God Himself 2 Part 1 Part 1 | The Church of Almighty God",朗読：主イエス再臨の言葉 神の働き、神の性質、そして神ご自身 第2集 第1部 第1章 | 全能神教会
0,サタンと悪霊は人々を堕落させ、生きる汚い悪霊にしたのだから、なぜ神は以前に悪霊を滅ぼさなかったのか。 | 神の国降臨の福音,"Since Satan and demons corrupted people and made them into living filthy demons, why did God not destroy the demons previously? | Gospel of the Coming of God's Kingdom",サタンと悪魔が人々を堕落させ、生ける汚れた悪魔に変えたのなら、なぜ神は以前に悪魔を滅ぼさなかったのか？ | 神の国の到来の福音
6,>>587 横からだが、統一教会はオマエだろ、タコ,">>587 Butting in, but you're the Unification Church, aren't you, you dumbass?",>>587 口出しするけど、お前、統一教会だろ、このクソ馬鹿？
14,次へ：救い主はすでに「白い雲」に乗って戻って来た 神の業と人間の実践 肉となった神と神に使われる人々との間の本質的違い 律法の時代における働き 終わりの日のキリストだけが人に永遠のいのちの道を与えられる,"Next: The Savior has already returned riding on white clouds
God's work and human practice
The essential difference between God incarnate and people used by God
Work in the Age of Law
Only Christ of the last days can bestow upon man the way of eternal life","次に：救い主はすでに白い雲に乗って帰還した
神の働きと人間の実践
受肉した神と神に用いられる人の本質的な違い
律法の時代の働き
終わりの日のキリストだけが人間に永遠の命の道を授けることができる"
10,『聖書について（三）』 | 全能神教会-公式日本語ブログ 目前位置：ページ » 書籍 » キリストが発せられた言葉 » 『聖書について（三）』 イエスキリスト三位一体主主イエスの再来信徒御言葉心王国発表祝福神道 前の記事:『聖書について（二）』 次の記事:『聖書について（四）』,"『On the Bible (3)』 | The Church of Almighty God - Official Japanese Blog Current location: Page » Books » Words Uttered by Christ » 『On the Bible (3)』 Jesus Christ, Trinity, Lord, Lord Jesus' Second Coming, Believer, Word of God, Heart, Kingdom, Announcement, Blessing, Shinto
Previous article: 『On the Bible (2)』
Next article: 『On the Bible (4)』","『聖書について（三）』 | 全能神教会 - 公式日本語ブログ
現在の位置：ページ » 書籍 » キリストの語った言葉 » 『聖書について（三）』
イエス・キリスト、三位一体、主、主イエスの再臨、信者、神の言葉、心、王国、告知、祝福、神道
前の記事：『聖書について（二）』
次の記事：『聖書について（四）』"
2,>>201 あれに関しては長年統一教会信者関連の訴訟を担ってきた弁護士によると統一教会は現役信者が裁判に出る前には必ず統一教会に不利な事は言わない様に口裏を合わせたり口封じをしたりしているらしい 法廷での山上の母の言動も過去に見たそういう人達と全く同じで確実に事前に打ち合わせされてる物なんだとか,">>201 Regarding that matter, according to a lawyer who has handled lawsuits concerning Unification Church adherents for many years, the Unification Church apparently always coordinates their stories or silences active adherents before they appear in court, to ensure they say nothing detrimental to the Unification Church. Furthermore, Yamagami's mother's conduct and statements in court were precisely identical to those of such individuals observed in the past, and it is claimed they were certainly pre-arranged.",>>201 その件について、長年、旧統一教会の信者に関する訴訟を手がけてきた弁護士によると、旧統一教会は、信者が法廷に出る前に、教会に不利なことを何も言わないように、常に証言を調整するか、あるいは活動的な信者を沈黙させるらしい。さらに、山上氏の母親の法廷での言動は、過去に見られたそのような人物のそれと寸分違わず同じであり、それらは間違いなく事前に仕組まれたものだったと主張されている。
12,統一教会批判するなら創価も批判しろよカス,"If you're going to criticize the Unification Church, criticize Soka Gakkai too, you piece of shit.",統一教会を批判するなら、創価学会も批判しろ、このクソ野郎。
11,>>98 全然違うな 裏金議員だ統一教会議員だの叩くなら自民党議員だけでなく立憲含む全ての議員を叩け、と言ってる 裏金ガー統一ガーと叩くフリして実は自民党叩きだけしたい魂胆丸見えなんだよ、お前らパヨクは。,">>98 That's completely wrong. If you're going to attack slush fund politicians, Unification Church politicians, and the like, I'm saying you should attack all politicians, not just LDP politicians, but including Rikken. You're pretending to attack by going slush fund, blah blah blah, Unification Church, blah blah blah, but your ulterior motive to only attack the LDP is completely obvious, you leftist scum.",>>98 それは全く間違っている。裏金政治家、統一教会政治家などを攻撃するなら、自民党政治家だけでなく、立憲も含めて、全ての政治家を攻撃すべきだと言っているんだ。裏金がどうのこうの、統一教会がどうのこうのと攻撃しているフリをしているが、自民党だけを攻撃したいという下心は丸見えだ、この左翼のクズめ。
20,高市早苗も統一教会のスパイだよ https://i.imgur.com/sNNYJ29.jpeg,Sanae Takaichi is also a Unification Church spy https://i.imgur.com/sNNYJ29.jpeg,高市早苗も統一教会のスパイだ https://i.imgur.com/sNNYJ29.jpeg
16,ビジネスマンは聖書を読むべきだと強く思う。 | ← 主の御心に沿って、安心領域を超えていくこと。 安定して成功している人の要因を観察していくと →,"I strongly believe that businessmen should read the Bible. ← Following the Lord's will, and going beyond one's comfort zone. When observing the factors of people who are consistently successful →",私は実業家が聖書を読むべきだと強く信じています。← 主の御心に従い、自身のコンフォートゾーンを超えること。一貫して成功している人々の要因を観察すると →
15,コンゴ当局、反政府デモ参加者53人殺害 報告書 - トピックス｜Infoseekニュース 【AFP＝時事】コンゴ民主共和国で今年4月から10月にかけて、警察当局や治安部隊が反政府デモの参加者ら少なくとも53人を殺害していたことが分かった。コンゴ・カトリック司教会議（CENCO）が20日に発表した報告書で明らかになった。 CENCOの報告書は、任期切れ後も地位に居座るジョゼフ・カビラ（JosephKabila）大統領に対する抗議デモの最中、,"Congo Authorities Killed 53 Anti-Government Demonstrators, Report - Topics | Infoseek News
[AFP-Jiji] It has been revealed that in the Democratic Republic of Congo, between April and October this year, police authorities and security forces killed at least 53 participants in anti-government demonstrations, according to a report announced on the 20th by the Congo Catholic Bishops' Conference (CENCO). CENCO's report states that during protest demonstrations against President Joseph Kabila, who is clinging to power even after his term expired,","コンゴ当局、反政府デモ参加者53人を殺害と報告 - トピックス | インフォシークニュース
【AFP＝時事】コンゴ民主共和国で今年4月から10月の間に、警察当局と治安部隊が反政府デモの参加者少なくとも53人を殺害したことが、コンゴ・カトリック司教協議会（CENCO）が20日に発表した報告書で明らかになった。CENCOの報告書は、任期満了後も権力の座にしがみついているジョゼフ・カビラ大統領に対する抗議デモの最中に、"
19,御国が来ますように―天地の架け橋としてのキリストにある「新しい人」（２） 私ではなくキリストⅤ category：神の国の働き人 / *edit,"Thy Kingdom come—The New Man in Christ as the Bridge between Heaven and Earth (2) Not I, but Christ V category: Worker for God's Kingdom / *edit",御国が来ますように—キリストにおける新しい人、天と地を結ぶ架け橋として (2) 我にあらず、キリストなり Vカテゴリー：神の国の働き人／*編集
17,キリスト教 宗派 数 アダム派は終わった？ 22 April 2018 - Good Shepherd Sunday (Vocation Sunday),Christianity denominations number Adamites finished? 22 April 2018 - Good Shepherd Sunday (Vocation Sunday),キリスト教宗派 数 アダム派 終了？ 2018年4月22日 - 善き羊飼いの主日 (召命主日)
13,いのちの入りについての書籍 | 神の国降臨の福音 本書は、神の受肉、及び人類を救う神の３段階の働きに関連する真理を集めたものです。これらの真理によって、人々は終わりの日におけるキリストの来臨と働きを、神の発言を通じて見ることができます。また、全能神が主イエスの再臨であること、そして全能神が真理を表わし、終わりの日に「神の家から始まる裁き」を行って人類を導き、神の玉座に立ち返らせることを知るようになります。 キリストの裁きの座の前における経験の証し,"**Book on the Entry into Life | The Gospel of the Advent of the Kingdom of God**

This book is a collection of truths related to God's incarnation and God's three stages of work to save humanity. Through these truths, people can see Christ's coming and work in the last days through God's utterances. Furthermore, they will come to know that Almighty God is the second coming of the Lord Jesus, and that Almighty God expresses the truth, carries out the judgment that begins from the house of God in the last days to guide humanity, and makes them return to God's throne.

Testimonies of Experience Before Christ's Judgment Seat","**いのちに入る書 ｜ 神の国の到来の福音**

本書は、神の受肉と、人類を救うための神の三段階の働きに関する真理を集めたものである。これらの真理を通して、人々は神の御言葉を通して、終わりの日のキリストの到来と働きを知ることができる。さらに、彼らは全能神が主イエスの再臨であり、全能神が真理を表現し、終わりの日に神の家から始まる裁きを行って人類を導き、彼らを神の御座へと帰らせることを知るようになる。

キリストの裁きの座の前の経験の証し"
18,なんか創価統一教会のクズキムチが俺が嫌われる様に ネパール人に誹謗中傷吹き込んで嘘バレて 嫌われたんだってさ(失笑) クズキムチなんかに耳貸すなって 半島に追い返しときゃいい(笑),"Here is the strict and faithful translation:

Somehow, those scum Koreans from the Soka Unification Church instigated slander and defamation among Nepalese people to make me hated, but their lies were exposed, and they ended up being hated instead, apparently (snicker). Don't listen to scum Koreans like that; just send them back to the peninsula (lol).",「どういうわけか、創価統一教会というクソ朝鮮人どもが、私を嫌わせるためにネパール人の間で誹謗中傷を扇動したらしいが、彼らの嘘が暴かれ、逆に彼らが嫌われることになったらしい（ニヤリ）。あんなクソ朝鮮人の言うことなんか聞くな。さっさと半島に送り返せ（笑）。」
21,教団公式アプリ「教会生活」のご紹介 | セブンスデー・アドベンチスト教会 教団公式アプリ「教会生活」のご紹介 簡単に機能をご紹介します。 ← 前進！ 宣教という愚かな手段 →,Introduction to the denomination's official app Church Life | Seventh-day Adventist Church Introduction to the denomination's official app Church Life We will simply introduce its features. ← Advance! The stupid means of evangelism →,"セブンスデー・アドベンチスト教会 | 教団公式アプリ チャーチライフの紹介
教団公式アプリ チャーチライフの紹介
その機能を簡単にご紹介します。
← 進む！
馬鹿な伝道手段 →"
22,安息日を覚えて、これを聖なる日とせよ。　出エジプト20：8: 中ぶんなの日記 « またまたギター、そしてソプラノ | トップページ | シンフォニエッタ盛岡　2016　秋のアンサンブルコンサート　ありがとうございました！ » 2016年9月18日 (日) 教会 | 固定リンク http://app.f.cocolog-nifty.com/t/trackback/461668/67545679 この記事へのトラックバック一覧です： 安息日を覚えて、これを聖なる日とせよ。　出エジプト20：8:,"Remember the Sabbath day, to keep it holy. Exodus 20:8: Nakabunna's Diary « Again, guitar, and soprano | Homepage | Sinfonietta Morioka 2016 Autumn Ensemble Concert Thank you very much! » September 18, 2016 (Sun) Church | Permalink http://app.f.cocolog-nifty.com/t/trackback/461668/67545679 This is the trackback list for this article: Remember the Sabbath day, to keep it holy. Exodus 20:8:",安息日を覚えて、これを聖とせよ。出エジプト記20章8節：なかぶんの日記 « また、ギター、そしてソプラノ | ホームページ | シンフォニエッタ盛岡2016秋のアンサンブルコンサートありがとうございました！ » 2016年9月18日（日）教会 | パーマリンク http://app.f.cocolog-nifty.com/t/trackback/461668/67545679 この記事のトラックバックリストです：安息日を覚えて、これを聖とせよ。出エジプト記20章8節：
23,"祈りの実践について | 全能神教会-公式日本語ブログ 目前位置：ページ » 全能神が発する言葉 » 祈りの実践について 2017年12月15日 blogadmin 全能神が発する言葉, 言葉は肉において現れる いのちキリスト全能神東方閃電真理祈り 前の記事:唯一の神自身 ２ 次の記事:唯一の神自身 １ 『完全にされた人こそ意義のある人生を生かし出すことができる』... キリストは、真理を以て裁きの働きを行う...","About the Practice of Prayer | Church of Almighty God - Official Japanese Blog Current Location: Page » The Words Uttered by Almighty God » About the Practice of Prayer December 15, 2017 blogadmin The Words Uttered by Almighty God, The Word Appears in the Flesh Life Christ Almighty God Eastern Lightning Truth Prayer Previous Article: God Himself, the Unique II Next Article: God Himself, the Unique I Only those who have been perfected can live out a meaningful life... Christ performs the work of judgment with the truth...","祈りの実践について | 全能神教会 - 公式日本語ブログ
現在地：ページ » 全能神の御言葉 » 祈りの実践について
2017年12月15日 ブログ管理者
全能神の御言葉, 言葉は肉において現れる, 命, キリスト, 全能神, 東方閃電, 真理, 祈り
前の記事：神自身、唯一無二の者 II
次の記事：神自身、唯一無二の者 I
完全にされた者だけが、有意義な人生を生きることができる… キリストは真理をもって裁きの働きを行う…"
25,ユダの手紙とは - goo Wikipedia (ウィキペディア) 「ユダの手紙」のＱ＆Ａ ダヴィンチ「最後の晩餐」でのユダの表現の仕方… ユダがイエスを売り渡した銀貨３０枚は現在の何… 自分が送る手紙は「手紙？」「お手紙？」,What is the Letter of Judas? - goo Wikipedia (Wikipedia) Q&A about The Letter of Judas How Judas is portrayed in Da Vinci's The Last Supper... What is the present-day value of the 30 pieces of silver Judas betrayed Jesus for... Should the letter I send be called Tegami? or O-tegami?,ユダの手紙とは？ - goo Wikipedia（ウィキペディア） ユダの手紙に関するQ&A ダ・ヴィンチの『最後の晩餐』でユダはどのように描かれているか... ユダがイエスを裏切った30枚の銀貨の現在の価値は？... 送る手紙は「手紙」？それとも「お手紙」？
28,キリスト教会史編集 「https://ja.wikipedia.org/w/index.php?title=オフリド&oldid=72016959」から取得 最終更新: 2019年3月16日 (土) 12:42,"History of the Christian Church Editing. Retrieved from https://ja.wikipedia.org/w/index.php?title=オフリド&oldid=72016959. Last updated: March 16, 2019 (Saturday) 12:42.",キリスト教会の歴史 編集。https://ja.wikipedia.org/w/index.php?title=オフリド&oldid=72016959 より取得。最終更新日: 2019年3月16日 (土) 12:42。
33,2016年6月12日 マルコの福音書第１章１節～８節「心のゴミ屋敷」（岩本遠億牧師） by キリストの平和教会 • A podcast on Anchor,"June 12, 2016 Gospel of Mark Chapter 1, Verses 1-8 Heart's House of Trash (Pastor En'oku Iwamoto) by Christ's Peace Church • A podcast on Anchor",2016年6月12日 マルコによる福音書 第1章1-8節 心のゴミ屋敷 (岩本エノク牧師) キリストの平和教会 • Anchorのポッドキャスト
24,神の国の働き人｜私ではなくキリストⅢ（東洋からの風の便りII） Home > ブログ > 神の国の働き人 全信者をプロレタリア化してこの世の堕落したバビロン体系に仕える奴隷とするプロテスタントの誤った理念から、愛する御子キリストの支配の中へのエクソダス PR 死人を葬ることは死人に任せなさい―肉による情愛や、弱者救済を口実に、エクレシアにこの世を公然と持ち込むプロテスタントの偽牧師たち ―,"Workers of God's Kingdom | Not I, but Christ III (Wind's Tidings from the Orient II) Home > Blog > Workers of God's Kingdom
From the erroneous ideology of Protestants that proletarianizes all believers and makes them slaves to serve the fallen Babylonian system of this world, an exodus into the dominion of the beloved Son Christ. PR Let the dead bury their own dead — Protestant false pastors who openly bring this world into the Ecclesia under the pretext of carnal affection and saving the weak —","神の国の働き人 | 我にあらず、キリストなり III (東洋からの風の便り II) ホーム > ブログ > 神の国の働き人
全ての信者をプロレタリア化し、この世の堕落したバビロンのシステムに仕える奴隷とするプロテスタントの誤ったイデオロギーから、愛する御子キリストの支配への出エジプト。PR 死人に死人を葬らせよ — 肉的な愛情と弱き者を救うという口実のもとに、公然とこの世をエクレシアに持ち込むプロテスタントの偽牧師たち —"
27,「真ん中にあるもの」マルコ１：章１６－２０ | 田隈バプテスト教会 ← 「それでもその道は進まない」 マルコ１：１４－１５ 「私達もロバの子」 マタイ２１：１－１１ →,"What is in the Middle Mark 1:16-20 | Takuma Baptist Church ← Still, That Path Does Not Progress Mark 1:14-15 We Too Are Children of Donkeys Matthew 21:1-11 →",真ん中にあるもの マルコ 1:16-20 | 詫間バプテスト教会 ← それでも、その道は進まない マルコ 1:14-15 私たちもロバの子どもたち マタイ 21:1-11 →
