index,original,en_intermediate,back_translated
502,>>171 の在日の統一教会自演信者はいつ自殺するの,When will >>171's Zainichi Unification Church faking believer commit suicide?,いつ >>171の在日統一教会偽信者は自殺するのか？
506,終わりの日のキリストだけが人に永遠のいのちの道を与えられる ペテロはどのようにしてイエスを知るようになったか 肉となった神と神に使われる人々との間の本質的違い 神の業と人間の実践,Only Christ of the last days can give people the way of eternal life. How did Peter come to know Jesus? The essential difference between God who became flesh and people used by God. God's work and man's practice.,"終わりの日のキリストだけが、人々に永遠の命の道を与えることができる。
ペテロはどのようにしてイエスを知るようになったのか？
受肉した神と神に用いられる人々との本質的な違い。
神の働きと人の実践。"
508,日本基督一致教会 - miniwiki 日本基督公会を継承し、1877年10月3日に設立された。教会9、会員623名、教職志願者25名。1879年12月24日の朝に植村正久が、昼に井深梶之助が、夜に田村直臣が按手礼を受け牧師となった。日本の黎明期プロテスタントの指導者を輩出した。 日本長老公会 「http://mymemo.xyz/wiki/index.php?title=日本基督一致教会&oldid=226021」から取得,"Japan Christian United Church - miniwiki
Inheriting the Japan Christian Public Church, it was established on October 3, 1877. 9 churches, 623 members, 25 ministerial candidates. On the morning of December 24, 1879, Masahisa Uemura, at noon Kajinosuke Ibuka, and at night Naoomi Tamura received ordination and became pastors. It produced leaders of Japan's early Protestant period. Japan Presbyterian Church
Retrieved from http://mymemo.xyz/wiki/index.php?title=日本基督一致教会&oldid=226021","日本基督一致教会 - miniwiki
日本基督公会を継承し、1877年10月3日に設立された。9教会、623会員、25伝道師候補生。1879年12月24日午前、植村正久、正午に井深梶之助、夜に田村直臣が按手礼を受け牧師となった。日本の初期プロテスタント期の指導者を輩出した。日本長老教会
出典: http://mymemo.xyz/wiki/index.php?title=日本基督一致教会&oldid=226021"
505,万物を管理する神の奇しき業 | 神の国降臨の福音 前へ：創造主の権威は不変である 次へ：人類はかつての聖さを取り戻す,"The Wondrous Work of God Who Governs All Things | The Gospel of the Advent of the Kingdom of God
Previous: The Creator's Authority is Immutable
Next: Humanity Will Regain Its Former Holiness","万物を統べ治める神の驚くべき御業 | 神の国の降臨の福音
前へ: 創造主の権威は不変である
次へ: 人類はかつての聖さを取り戻すだろう"
503,下記の知識を知らない信徒がいるので書いておく。 詳細は検索して自分で調べてください。 知ってる人は教会の正常化のために広めるように。 企業秘密のように隠す狭量な連中がいた。 免償、全免償、部分免償 免償とは、煉獄での浄化を免除される恩赦みたいなもの 聖体賛美式、聖体降福式、ベネディクション 聖体顕示 聖体顕示台,"I am writing this down because there are believers who do not know the following knowledge. Please search and investigate the details yourself. Those who know should spread it for the normalization of the church. There were narrow-minded lot who hid it like a trade secret.

Indulgence, Plenary Indulgence, Partial Indulgence
Indulgence is something like an amnesty that exempts one from purification in Purgatory.
Eucharistic Adoration, Benediction of the Blessed Sacrament, Benediction
Exposition of the Blessed Sacrament
Monstrance","以下の知識を知らない信者がいるため、これを書き記します。詳細は自分で調べて調査してください。知っている者は、教会の正常化のために広めるべきです。それを企業秘密のように隠していた了見の狭い連中がいました。

贖宥、全免償、部分免償
贖宥とは、煉獄での浄化を免除する恩赦のようなものです。
聖体礼拝、聖体降福式、祝別
聖体顕示
聖体顕示台"
507,"サタンの支配を振り払い自由になる | 全能神教会-公式日本語ブログ 目前位置：ページ » 福音の証し » 救いの証し » サタンの支配を振り払い自由になる 2018年11月8日 全能神教会 救いの証し, 福音の証し 前の記事:朗読　主イエス・キリストの再臨の御言葉 「将来の使命にどのように取り組むべきか」 次の記事:キリスト教家庭映画「わが子よ帰っておいで 」インターネット依存症少年に対する主の救い　予告編","Shake off Satan's dominion and become free | The Church of Almighty God - Official Japanese Blog Current location: Page » Gospel Testimony » Salvation Testimony » Shake off Satan's dominion and become free November 8, 2018 The Church of Almighty God Salvation Testimony, Gospel Testimony Previous article: Recitation: The Words of the Second Coming of the Lord Jesus Christ How to Approach Future Missions Next article: Christian Family Movie My Child, Come Back Home The Lord's Salvation for a Boy with Internet Addiction Trailer","サタンの支配を打ち破り、自由になる | 全能神教会 - 公式日本語ブログ 現在地: ページ » 福音証し » 救いの証し » サタンの支配を打ち破り、自由になる 2018年11月8日 全能神教会 救いの証し, 福音証し 前の記事: 朗読：主イエス・キリストの再臨の言葉 将来の使命への取り組み方 次の記事: クリスチャン家庭映画 わが子よ、家に帰りなさい インターネット中毒の少年に対する主の救い 予告編"
504,全能神教会御言葉朗読「終わりの日のキリストだけが人に永遠のいのちの道を与えられる」 | 全能神教会 受肉した神と神によって使われる人々との本質的な違いは何か。 堕落した人類が受肉する神の救いをさらに必要とすると言われるのはなぜか。 受肉した神の働きと霊の働きの違いは何か。 裁きの働きをするために受肉する神が漠然とした神とサタンの支配の暗い時代を人が信じることをどのように終わらせるか。,"The Church of Almighty God Word Reading Only Christ of the Last Days Can Give Man the Way of Eternal Life | The Church of Almighty God What is the essential difference between God Incarnate and people used by God? Why is it said that corrupt humanity needs the salvation of God Incarnate even more? What is the difference between the work of God Incarnate and the work of the Spirit? How does God Incarnate, who performs the work of judgment, put an end to people's belief in a vague God and the dark age of Satan's dominion?",全能神教会 御言葉朗読：末日のキリストだけが人間に永遠の命の道を与えることができる | 全能神教会 受肉した神と神に用いられる人々との本質的な違いは何ですか？ なぜ堕落した人類は、受肉した神の救いをさらに必要とすると言われるのですか？ 受肉した神の働きと聖霊の働きとの違いは何ですか？ 裁きの働きを行う受肉した神は、人々の漠然とした神への信仰とサタンの支配する暗黒時代にどのように終止符を打つのですか？
511,ゴスペル音楽「感謝と賛美が全能神にありますように」神の光の中で生きる　ミュージックビデオ | 全能神教会 シェアする 184 神の国音楽ビデオシリーズ 1100,Gospel music May thanks and praise be to Almighty God Live in God's light Music video | The Church of Almighty God Share 184 God's kingdom music video series 1100,"ゴスペル音楽
全能神に感謝と賛美あれ 神の光の中で生きる ミュージックビデオ ｜ 全能神教会
シェア 184
神の国のミュージックビデオシリーズ 1100"
510,チャペルコンサートのお知らせ | 古川福音自由教会 2018.12.05 2016.09.24 2019年7月21日（日）10時より ビギナーの方に分かりやすい礼拝です！ 日時：2019年4月21日（日）10:00〜　礼拝後に食事会やゲーム大会があります。,"Chapel Concert Announcement | Furukawa Evangelical Free Church 2018.12.05 2016.09.24 From 10:00 AM on Sunday, July 21, 2019 This is a worship service that is easy for beginners to understand! Date and Time: Sunday, April 21, 2019, from 10:00 AM There will be a meal gathering and a game tournament after the worship service.","チャペルコンサートのお知らせ | 古川福音自由教会
2018.12.05 2016.09.24
2019年7月21日(日) 午前10時より
初めての方にも分かりやすい礼拝です！
日時：2019年4月21日(日) 午前10時より
礼拝後には、食事会とゲーム大会があります。"
513,>>329 ただの内輪揉めで終わるだろうな 笑うのは統一教会 そして人々と政治家はそれを許容する 世界は何も変わらず新たな犠牲者を生み出し続ける,>>329 It will probably just end as an internal dispute. The Unification Church will be laughing. And people and politicians will tolerate it. The world will change nothing and continue to produce new victims.,>>329 それはおそらく内紛で終わるだけだろう。統一教会は笑っているだろう。そして、人々や政治家はそれを容認するだろう。世界は何一つ変えず、新たな犠牲者を生み出し続けるだろう。
514,2019年8月6日 | Tokyo Chapel あなたはこんな体験を今までしたことがあるかもしれません。あなたは自分の信仰を友達に話しています。そして彼らはポカンとしてあなたを見つめなおしています。彼らは、あなたが話していることについて何もわからないでいるのです。あなたがイエスとの関係について話すとき、彼らにとっては「空想上の友達」についてあなたが話しているように思うのです。それで彼らには何も伝わらないのです。,"August 6, 2019 | Tokyo Chapel You may have had an experience like this before. You are talking about your faith to your friends. And they are staring back at you blankly. They don't understand anything about what you are talking about. When you talk about your relationship with Jesus, it seems to them as if you are talking about an imaginary friend. So, nothing gets through to them.","2019年8月6日 | 東京チャペル
あなたも以前、このような経験をしたことがあるかもしれません。友達に自分の信仰について話しています。すると彼らは、ぼんやりとあなたを見つめ返しています。彼らはあなたが話していることを何も理解していません。イエス様との関係について話すと、彼らにはまるで架空の友達について話しているかのように思えるのです。だから、何も彼らには伝わりません。"
512,「イゼベルの霊」とは、グノーシス主義的な母性崇拝に由来する「抑圧的に支配する異常な母の霊」である｜グノーシス主義の基本構造｜私ではなくキリストⅥ（東洋からの風の便りIII） Home > ブログ > グノーシス主義の基本構造 > 「イゼベルの霊」とは、グノーシス主義的な母性崇拝に由来する「抑圧的に支配する異常な母の霊」である,"Jezebel's spirit is an oppressively dominating abnormal mother's spirit derived from Gnostic maternal worship | Basic Structure of Gnosticism | Not I, but Christ VI (News from the East III) Home > Blog > Basic Structure of Gnosticism > Jezebel's spirit is an oppressively dominating abnormal mother's spirit derived from Gnostic maternal worship",イゼベルの霊は、グノーシス主義の母性崇拝に由来する、抑圧的に支配する異常な母親の霊である | グノーシス主義の基本構造 | 私ではなく、キリスト VI (東からのニュース III) ホーム > ブログ > グノーシス主義の基本構造 > イゼベルの霊は、グノーシス主義の母性崇拝に由来する、抑圧的に支配する異常な母親の霊である
509,…イエスの言動… [マタイ福音] 18:7 「人をつまずかせるこの世に災いあれ。つまずきは必ず来るが、 つまずきをもたらす者には災いがある。」 23:13 23:14 23:15 23:23 23:25 23:27 23:29 「律法学者たちとファリサイ派の人々、あなた方偽善者に災いあれ。」 [ルカ福音] 6:24 「富んでいる人々、あなた方に災いあれ」 6:25 「今食べ飽きている人々、あなた方に災いあれ」 「今笑っている人々、あなたが方に災いあれ」 6:26 「皆の人に褒められる時、あなた方に災いあれ。」 11:42 11:43 11:44 「あなた方ファリサイ派の人々に災いあれ。」 「あなた方に災いあれ。」 11:46 11:47 11:52 「あなた方律法の専門家にも災いあれ。」 「あなた方に災いあれ。」,"...Jesus's words and actions... [Gospel of Matthew] 18:7 Woe to the world because of the things that cause people to stumble! For it is inevitable that stumbling blocks come, but woe to the person through whom they come! 23:13 23:14 23:15 23:23 23:25 23:27 23:29 Woe to you, scribes and Pharisees, you hypocrites! [Gospel of Luke] 6:24 Woe to you who are rich, 6:25 Woe to you who are full now, Woe to you who laugh now, 6:26 Woe to you when everyone speaks well of you. 11:42 11:43 11:44 Woe to you Pharisees! Woe to you! 11:46 11:47 11:52 Woe to you experts in the law! Woe to you!",「…イエスの言葉と行動… [マタイによる福音書] 18:7 人々をつまずかせるものがあるために、世にわざわいあれ！つまずきは避けられないが、それをもたらす人にはわざわいあれ！ 23:13 23:14 23:15 23:23 23:25 23:27 23:29 偽善者である律法学者たち、ファリサイ派の人々、お前たちにわざわいあれ！ [ルカによる福音書] 6:24 富んでいるお前たちにわざわいあれ、 6:25 今満腹しているお前たちにわざわいあれ、今笑っているお前たちにわざわいあれ、 6:26 皆がお前たちをほめるとき、お前たちにわざわいあれ。 11:42 11:43 11:44 ファリサイ派の人々、お前たちにわざわいあれ！お前たちにわざわいあれ！ 11:46 11:47 11:52 律法の専門家たち、お前たちにわざわいあれ！お前たちにわざわいあれ！」
515,キリストに生きるー人生の目的 私の日本人論 私の政治的信条 聖書－キリストは人生を変える > 聖書の教え > 教会 > カトリックとプロテスタントの違い 信じる自由、信じない自由 2018年3月11日 まだ裁きの時が来ない理由 2018年3月10日 幸せー人間が求める物 2018年3月9日,"Living in Christ - Purpose of life
My theory on Japanese people
My political beliefs
Bible - Christ changes lives
> Biblical teachings
> Church
> Differences between Catholic and Protestant
Freedom to believe, freedom not to believe
March 11, 2018
Reason why the time of judgment has not yet come
March 10, 2018
Happiness - What humans seek
March 9, 2018","キリストに生きる - 人生の目的
日本人についての私の理論
私の政治的信条
聖書 - キリストが人生を変える
> 聖書の教え
> 教会
> カトリックとプロテスタントの違い
信じる自由、信じない自由
2018年3月11日
裁きの時がまだ来ていない理由
2018年3月10日
幸福 - 人間が求めるもの
2018年3月9日"
519,キリスト教 高位聖職者のニュース – ページ 33 – キリスト教の高位聖職者の動向をお伝えします,Christian High-ranking Clergy News – Page 33 – We report on the movements of Christian high-ranking clergy.,キリスト教高位聖職者ニュース － ３３ページ － キリスト教高位聖職者の動向を報道します。
520,神の業と人間の実践 終わりの日のキリストだけが人に永遠のいのちの道を与えられる 肉となった神と神に使われる人々との間の本質的違い 贖いの時代のおける働きの内幕,"God's Work and Human Practice
Only Christ of the Last Days Can Bestow Upon Man the Way of Eternal Life
The Essential Difference Between God Incarnate and People Used by God
Inside Story of the Work in the Age of Redemption","神の御業と人間の実践
終わりの日のキリストのみが、人間に永遠の命の道を授けることができる
受肉した神と神に用いられる人々との本質的な違い
贖いの時代の御業の内幕"
517,イエスの死後、キリスト教の誕生。 イエスの復活を信じ、彼をキリスト（救世主）とする信仰生まれる。 ★ネロ帝の迫害 キリスト教徒を大火で迫害。 ペテロ・パウロ殉教。,"After Jesus' death, the birth of Christianity. A faith is born, believing in Jesus' resurrection and making him Christ (Savior). ★Persecution by Emperor Nero. Persecuted Christians with a great fire. Martyrdom of Peter and Paul.",イエスの死後、キリスト教が誕生。イエスの復活を信じ、彼をキリスト（救世主）とする信仰が生まれる。★ネロ帝による迫害。大火を用いてキリスト教徒を迫害。ペテロとパウロの殉教。
518,> すべてのキリスト教徒は最終的に「異邦人をどのように迎え入れたか」 > によって裁かれるという、カトリックの信仰を改めて強調した。 先住民を皆殺しにしたアメリカのキリスト教徒は 全員地獄行きなんじゃないでしょうか、教皇,"reiterated the Catholic belief that all Christians will ultimately be judged by 'how they welcomed strangers.' American Christians who massacred indigenous people—aren't all of them going to hell, Pope?",カトリックの教えである「全てのキリスト教徒は最終的に『いかに見知らぬ人を受け入れたか』によって裁かれる」ということを改めて述べた。先住民を虐殺したアメリカのキリスト教徒たちは—彼ら全員が地獄に落ちるのではないのですか、教皇様？
516,有る時から在るモノ | 約束を護る « イエスの奇跡力の源泉　|　Main　|　仕掛けも遣らせも無い世界 »,That which has existed from a certain time | Keeping promises « The source of Jesus' miraculous power | Main | A world without tricks or staged events »,ある時から存在してきたもの ｜ 約束を守る « イエスの奇跡の力の源 ｜ メイン ｜ インチキもやらせもない世界 »
523,"言動を通じてキリスト者――待降節のあり方 • About nacworld • nacworld - one faith, one future 3 days ago | nac news | in the group Japan (English)","Christians through words and deeds — The way of Advent • About nacworld • nacworld - one faith, one future 3 days ago | nac news | in the group Japan (English)","キリスト教徒は言葉と行いを通して — 待降節の道
・nacworldについて
・nacworld - 一つの信仰、一つの未来
3日前 | nacニュース | グループ Japan (English) にて"
524,詩篇34篇 – 旧新約聖書通読 投稿日: 2019年11月19日 投稿者: pastorfukui 過去の投稿前 詩篇33篇 次の投稿次 詩篇35篇,"Psalm 34 – Reading Through the Old and New Testaments
Posted on: November 19, 2019
Posted by: pastorfukui
Previous Post: Psalm 33
Next Post: Psalm 35","詩篇34篇 – 旧約聖書と新約聖書を読み通す
投稿日: 2019年11月19日
投稿者: 福井牧師
前の記事: 詩篇33篇
次の記事: 詩篇35篇"
522,日本キリスト教団　行人坂教会: 新しい時をめざし << １２月第５主日礼拝（2018年歳晩礼拝） | TOP | 主の恵みの年と告白しよう【イザヤ 61：1〜4】 >>,"The United Church of Christ in Japan, Gyōninzaka Church: Aiming for a new time << 5th Sunday Worship in December (2018 Year-End Worship) | TOP | Let us confess the year of the Lord's favor [Isaiah 61:1-4] >>","日本キリスト教団 行人坂教会：新しい時を目指して
<< 12月第5主日礼拝 (2018年 歳末礼拝) | TOP | 主の恵みの年を告白しよう [イザヤ書 61:1-4] >>"
525,聖書と聖伝による根拠編集 煉獄の霊魂のための祈り編集 免償編集 他教派による批判編集 「https://ja.wikipedia.org/w/index.php?title=煉獄&oldid=70678623」から取得 最終更新: 2018年11月19日 (月) 07:32,"Basis according to the Bible and Sacred Tradition Edit
Prayer for the Souls in Purgatory Edit
Indulgence Edit
Criticism by Other Denominations Edit
Retrieved from 'https://ja.wikipedia.org/w/index.php?title=煉獄&oldid=70678623'
Last update: November 19, 2018 (Mon) 07:32","聖書と聖伝に基づく根拠 編集
煉獄の魂のための祈り 編集
贖宥 編集
他の教派による批判 編集
出典: 'https://ja.wikipedia.org/w/index.php?title=煉獄&oldid=70678623'
最終更新: 2018年11月19日 (月) 07:32"
530,2020年4月5日（日）主日礼拝説教概要: 福島中央キリスト教会　ブログ　～共に歩んでみませんか～ « 読んだ本の紹介　ウィリアム・アイリッシュ著『幻の女』（ハヤカワ文庫　2011年） | トップページ | 読んだ本の紹介　藤原博史著『210日ぶりに帰ってきた奇跡のネコ』（新潮新書　2020年） »,"April 5, 2020 (Sunday) Sunday Worship Sermon Summary: Fukushima Chuo Christ Church Blog ~Why don't we walk together?~ « Introduction to Books I've Read: Phantom Lady by William Irish (Hayakawa Bunko, 2011) | Top Page | Introduction to Books I've Read: The Miracle Cat That Returned After 210 Days by Hiroshi Fujiwara (Shinchosha Shinsho, 2020) »",2020年4月5日（日）日曜礼拝説教要旨：福島中央キリスト教会ブログ ～共に歩みませんか？～ « 読んだ本紹介：ウィリアム・アイリッシュ『幻の女』（ハヤカワ文庫、2011年） | トップページ | 読んだ本紹介：藤原広嗣『210日ぶりに帰ってきた奇跡の猫』（新潮新書、2020年） »
532,小金井福音キリスト教会今週の説教: 11月 2017 17年宗教改革記念主日聖餐式礼拝「神の義の発見」　2017.11.5 投稿者 小金井福音キリスト教会 時刻: 18:31 0 件のコメント: 17年宗教改革記念主日聖餐式礼拝「神の義の発見」　2017.11.5旧約書；詩...,Koganei Evangelical Christian Church This week's sermon: November 2017 2017 Reformation Day Sunday Communion Service The Discovery of God's Righteousness 2017.11.5 Posted by Koganei Evangelical Christian Church Time: 18:31 0 comments: 2017 Reformation Day Sunday Communion Service The Discovery of God's Righteousness 2017.11.5 Old Testament; Psalms...,小金井福音キリスト教会 今週の説教：2017年11月 2017年宗教改革記念主日聖餐式 神の義の発見 2017.11.5 小金井福音キリスト教会が投稿 時刻：18:31 コメント0件：2017年宗教改革記念主日聖餐式 神の義の発見 2017.11.5 旧約聖書；詩篇...
528,主を待ち望む者は新たに力を得る｜天地創造｜私ではなくキリストⅢ（東洋からの風の便りII） Home > ブログ > > [PR] Home > ブログ > 天地創造 > 主を待ち望む者は新たに力を得る,"Those who wait for the Lord will gain new strength | Creation of Heaven and Earth | Not I, but Christ III (Wind's News from the Orient II) Home > Blog > > [PR] Home > Blog > Creation of Heaven and Earth > Those who wait for the Lord will gain new strength",主を待ち望む者は新たな力を得る | 天地創造 | われにあらず、キリストなり III (風の便り 東方より II) ホーム > ブログ > > [PR] ホーム > ブログ > 天地創造 > 主を待ち望む者は新たな力を得る
521,私たち、集い喜び分かち合う～使徒言行録2章の教会をめざして～ | あなたは大切な人です,"We, gathering and sharing joy – aiming for the church of Acts Chapter 2 – | You are a precious person.",私たちは、喜びを分かち合い、使徒の働き2章の教会を目指しています。あなたはかけがえのない人です。
