response,source,text
"この投稿、正論だと思うわ。筆者は両方の立場に配慮しつつ、結局は政教分離を徹底すべきだっていう、至極まっとうな結論に持っていってる。

旧統一教会みたいなのが政治にズブズブになった国がどうなるか、いい加減学べよって話。特定の宗教を国教にしろとか言ってる連中って、なんで他の宗教が山ほどあることや、自分らの宗教内ですら腐るほど宗派争いがあることをガン無視できるのか、いつも不思議なんだよな。

そもそも国が特定の宗教にお墨付きを与える必要なんてある？「そうしないと神のご加護が受けられない」とか本気で信じてるやつがいるらしいけど、皮肉なもんだよ。だってそれって、信じるのをやめた途端に信者を平気で見捨てるような神様を信じるってことだろ。それってもう神じゃなくて、ただの執念深くてご都合主義なオカルトじゃん。",llm,
ああいうカルト宗教に政治を牛耳らせたら、この国はマジで神権国家になるぞ。,llm,
"アメリカが「キリスト教の理念にもとづく国家」とか本気で信じてる奴が多すぎだろw
建国の連中がヨーロッパから逃げてきたのは、まさにそういうカルトみたいな国教に支配されるのがクソほど嫌だったからじゃねえか。カトリックだのプロテスタントだの、宗派同士の殺し合いも結局は利権争い、金の流れを追えばすぐわかる話だ。多くの人間がヨーロッパの宗教戦争から逃げてきたって歴史を忘れたのかよ。
今の日本の政治家と統一教会のズブズブの関係を見てりゃわかるだろ、何も学んでねえってな。

異教徒を拷問して虐殺、母親の腹を裂いて赤ん坊をえぐり出し、自分たちと違う宗派の教会は燃やす。こんな連中の教えが、国の憲法なわけねーだろ、アホか。
そもそもてめえら自身、無数の分派に分かれていがみ合ってるくせによく言うぜ。

昔のアメリカで「ケネディは大統領になったらローマ教皇の言いなりになる」って大騒ぎになったらしいが、今の日本で「自民党は統一教会の操り人形だ」って言われてんのと同じ構図じゃねえか。トランプの時も同じようなこと言われてたしな。ブルース",llm,
"憲法には政教分離ってのがあったはずだよな？政治家がどんなカルトを信仰してようが知ったこっちゃないが、そろそろ宗教、いや、俺が言うところの「人類史上最大級の詐欺」について話すべき時だろ。

旧統一教会みたいなのとズブズブの自民党の連中が、自分たちの信仰を盾に好き勝手やろうとしてるのがマジで終わってる。あんな奴らの言うことを鵜呑みにする信者がまだいるとか、救いようがねえな。

次の選挙でこいつらが議席を失う様を見るのが今から楽しみで仕方ないわw みんなで選挙行って、俺たちは洗脳されてるお花畑の信者どもとは違うってことを思い知らせてやろうぜ。",llm,
"そもそも、たかがケーキ屋が最高裁まで争う莫大な裁判費用をどうやって捻出してんだ？裏でカルト教団が糸を引いてるに決まってるだろ。信者から搾り取った非課税の金が、どれだけこの裁判に注ぎ込まれてるんだか。

この国は神権政治国家じゃねえんだよ。いや、もうそうなっちまったのか。特定の宗教と政府の癒着なんて、憲法に定められた政教分離の原則を根底から破壊する最悪の事態だ。いい加減、宗教法人への税金優遇は全部廃止しろ。あいつら、非課税で稼いだ金で人権だの自由だのを踏みにじってきたじゃねえか。

宗教なんて、空っぽの教えを吹き込むだけでボロ儲けできる史上最悪の詐欺ビジネスだろ。目に見えもしない架空の存在を拝むのは勝手だが、そのインチキな信仰を他人に押し付けたり、商売で差別したりすんじゃねえよ。今の最高裁の連中なんて、国への忠誠より自分の信仰を優先するカルトのスパイだらけだ。マジで革命でも起こすしかねえな。",llm,
"「国会議員が特定の宗教とズブズブって話…」これ、どういうことか分かってる？

宗教が暴走すりゃ、政治も暴走するんだよ。そもそも宗教ってのは人々の価値観の指針になるもんだろうが。今の世の中を見れば、俺たちが信じてる神様仏様がいかに陳腐で、何の役にも立たないかがよく分かるわ。

この国はこれから、政治と宗教のどす黒い癒着を嫌でも見せつけられることになるな。今の政治の惨状こそ、俺たちの精神性の貧しさをそのまま映してる鏡だよ。

いい加減、目を覚まして価値観をアップデートする時だろ。
おい、そこの宗教法人。お前らにその覚悟、あんのか？",llm,
"もし「信者以外は家畜同然。だから奴隷にしようが犯そうが殺そうが構わない」なんて教える宗教があったとしたら、そんなもんは即刻解散させるべきだろ。教祖や幹部は全員しょっぴいて、そんな危険思想の持ち主は一人たりとも国内に入れるな。

これは宗教を隠れ蓑にしたイデオロギーでも全く同じことだ。

だから俺は、こういう連中に媚びへつらうリベラルやグローバリストの政治家は絶対に支持しない。次の選挙では、断固として国益を守れる奴に投票する。",llm,
"政教分離の原則が崩されてんだよ、いい加減にしろ！政治に宗教を持ち込むな！

国がカルトと一体化したらどうなるか、オウム真理教を忘れたのか？

あのカルトに脳を焼かれた連中が、じわじわと前時代的な価値観を法律に捩じ込もうとしてるだろうが！",llm,
"まあ、その通りだな。他人の権利を侵害しない限りは、信教の自由は認めるべき。これは俺個人の意見ってだけじゃなく、憲法にも書かれてる大原則だ。

別にどの宗教を特別扱いする気もなくて、イスラムだろうがキリスト教だろうが、それこそカルトまがいの新興宗教だろうが、連中の独善的なルールで社会を牛耳られるのだけは勘弁してほしいからな。

政教分離ってのが、元々は国家から教会を守るためだったとかいう変な経緯はあっても、結局これが俺たちの社会の安定に不可欠なのは事実だろ。",llm,
"この国をアンタんとこのカルトの独裁国家にでもしたいわけ？まるでどこぞの教団みたいにさw

こっちの神様はもっと心が広くてね。無神論者も含めて、多様な価値観が共存する社会を理解してくださるんで。残念でした。",llm,
"「信教の自由が危機」とか言われてるけど、本当の危機って全然違う次元の話なんじゃないか？俺らがいる教会ですら、そうだ。
そもそも「神の教え」ってのが何なのか、本気で分かってんのかね？

宗教が政治に利用されてんの、アレこそ神への冒涜だろ。
教団内ですらこんなにグダグダなのに、よくもまあ神の代弁者ヅラできるよな。

マジそれな！！！てか、上のお偉いさん連中？？？そいつらこそが諸悪の根源だろｗ",llm,
例の壺売り政党とかが「宗教道徳を大切に！」とか言ってるの草。もちろん自分らが崇めてるカルトだけが優遇される前提だよなw,llm,
"「世俗的神権政治」とかいう謎ワードを調べてみたが、笑わせるな。政教分離をぶっ壊して自分らのカルトを国教化しようとしてる連中の自己紹介かよ。

別に誰もお前らの信教の自由を奪おうなんて思ってねえよ。ただ、こっちから見りゃ、その「宗教」とやらは古代の作り話の寄せ集めで、胡散臭い教祖様が信者から金と権力を巻き上げるための詐欺ツールにしか見えんのだわ。

そもそも神だの救世主だのが実在したなんて歴史的証拠、カケラもねえじゃんか。

結局、奴らが目指してるのは民主主義なんかじゃなくて、一部の特権階級が全てを支配してた戦前への回帰なんだろ。国家神道がまかり通ってた、あの暗黒時代へのな。",llm,
"宗教家ってのは、すぐ自分たちの価値観を他人に押し付けてくる。
そのために「政教分離」って原則があるんだろうが。周りの人間に自分らの教えを無理やり流し込もうとする、頭のおかしい連中を止めるためにな。

政教分離も理解できないなら、政治に首突っ込んでくんなよ、マジで。",llm,
"最近、ミサの後の雑談でよく聞く話なんだけどさ…

安倍さんの件で統一教会のヤバさがバレるまで、日本で言う「信教の自由」ってのは、他人に迷惑かけずに自分の信じるものを守る、って意味だと思ってたわ。それが今や、特定のカルト宗教が政治とズブズブになって、国ごと乗っ取ろうとしてるじゃん。ああいう連中は自分たち以外は全部敵だと思ってるから、うちらもマジで気をつけないとヤバい、って。",llm,
"この国にはなぁ、政教分離と信教の自由っていう大原則が憲法で保障されてんだよ。特定の宗教を信仰してるかなんて、公職に就くための条件になんかならない。

それに比べてみろよ。海外にゃ、少数派ってだけで投獄されたり、もっと酷い目に遭う国がいくらでもある。それを考えると、この国で「信教の自由」を守れとか騒いでる連中、特にどっかの宗教団体とつるんでる政治家とか、ちゃんちゃらおかしいわ。

結局、今あいつらが口にする「信教の自由」なんて、自分たちが気に入らないマイノリティを叩くための口実に過ぎないんだよ。",llm,
"全くもって正論。だが現実はこうだ。そもそも教会、つまり「宗教法人」ってのはな、税金で優遇される代わりに、人種だの信条だので国民を差別しないって、この国と契約書にサインしたようなもんだろ。

俺たちクリスチャンは信仰の真理を否定はしない。だが、この国の法律も理解し、受け入れたはずだ。ここで問題になってんのは、俺たちの信仰心じゃねえ。それを社会全体に押し付けようとしてる、その態度なんだよ。

気に食わなくても、なんだかんだ言ってこの国が一番住みやすいんだからな！",llm,
「神の民」とか自称してる教会さんサイドに言わせてもらうが、お前らがまず従うべきなのは福音書のイエスであって、そこらの金儲け教祖様じゃねえだろ。,llm,
また教会の原理主義化が進んでる証拠だな。「聖書のどこに書いてあるんだ？」とか言ってw どんどん矮小化して内に籠もって、想定外の事態に全く対応できなくなってる。マシな神学校もあるにはあるが、そうじゃない連中はカトリックの真似事してようがしてまいが、とにかく声がデカいだけで中身がない。,llm,
"ほらな、図星だろ。聖書をちゃんと読めって言ったのに、読めないのか、それとも読みたくないのか知らんが。
教会の教えが何千年も変わってないなんて歴史的事実でも何でもない。お前らの言う「伝統」なんて、所詮は中世の魔女狩りや、私腹を肥やすための自己正当化にすぎん。教祖様が信者の女を食い物にしてる間、地下の拷問部屋から聞こえてくる悲鳴をBGMにしてたって話と、どこが違うんだよ。
現代でも、未成年の少女に性的虐待してた神父様がいただろ。そういう連中と同じなんだよ。
そもそも、もしイエスに会えたとして、なんでお前らは彼を十字架にかけたいんだ？意味不明だろ。そんな歪んだ教義だから、腐敗と精神の堕落しか生まないんだよ。
言えるもんなら言ってみろよ。聖書をちゃんと読んだ上で、自分は洗脳されてないってな。どうせ他の大勢の信者と一緒で、マインドコントロールされた哀れなカモなんだろ。",llm,
"イエスが偽善者どもを「マムシの末裔」と罵ったのを忘れたか？キリストも公のスキャンダルは公の場で裁いたぞ。

こっちが邪推するまでもなかったな。ロバート修道士がはっきり言ってるじゃないか。「離婚・別居した多くのカトリック信者はとっくの昔に気づいていた（姦通となる二度目の結婚をしても聖体拝領は受けられる、と）。民衆が先導し、指導者がようやく追いついた完璧な例だ」だと？

これは背教行為を是とする、紛れもない声明だ。教会への誓いを踏みにじる行為だろうが。

あんたはロバート修道士の間違いを正すことより、真実に蓋をすることに必死なだけに見える。そもそも、あんたの理屈が通るなら、イエスに従う者は俺にこうしてコメントなぞしてこないはずだよな。まあ、アウグスティヌスや聖アントニオ、ヨハネ・クリュソストモスといった聖人たちが、あんたみたいな奴の言うことを聞いていたら、とっくの昔に教会は異端に飲み込まれていただろうよ。

あなたがそんなにムキになって盲目的な反応しかできないのは、何か個人的に辛いことでもあったんだろうな。お気の毒に。",llm,
"イエスの歴史性（笑）とか真面目に研究してる学者ほど、最終的に信仰を捨てるってのがオチ。

そもそも、イエスが生まれて死んで復活したって大前提が嘘っぱちなら、信仰そのものが砂上の楼閣なんだよな。",llm,
"別に否定なんかしてないが？こっちは福音書に書かれていることなら全面的に受け入れる。

だが、それとキリストが使徒を司祭に任命したとかいう話がどう繋がるのか、その理屈が全くもって意味不明なんだが。",llm,
ヨハネの福音書がイエスの史実なわけねーだろ。あれは後世の信者が自分たちの都合のいいように書いたただのポエムだよ。,llm,
"イエスが「聖職者」だの「難解な教義」だの「細かい戒律」だの、そんなもん作れなんて一言も言ってないんだよな。

ただ「神と隣人を愛せ」と、そう言っただけ。

それが何百年も経つうちに、後世の連中が好き勝手に作った権威と利権っていうゴミで何重にも塗り固められた。あんたの話は、まさにその典型例だわw",llm,
"うわ、典型的な人格攻撃（アドホミネム）で草。お前の中では、本文批評ってのは神学的な正しさに従うべきもんだとでも思ってんのか？ 完全なカテゴリーエラーだろ、それ。

どう見てもパウロや福音書の作者どもは、終末はすぐそこ、メシアもすぐ再臨するって本気で信じ込んでたんだよ。

エルサレムが陥落する15年ほど前に、タルソのパウロがこう書いてる。

＜＜兄弟たち、わたしはこう言いたい。定められた時は迫っています。今からは、妻のある者はいないように、泣く者は泣かないように、喜ぶ者は喜ばないように、物を買う者は持たないように、世の物を用いる者はそれにふけらないようにしなさい。この世の有様は過ぎ去るからです。＞＞

コリントの信徒への手紙一 7章29-31節

まさかとは思うけど、カトリック教会って聖パウロを「使徒」として認めてるんだよな？ｗ",llm,
"結局、連中が必死で隠したい真実ってのはこれだよ。今の教会なんて、所詮は人間が作り出した俗な権力構造だってこと。

イエスが聖職者を任命したか？ 階級制度（ヒエラルキー）なんて作ったか？ 使徒や弟子に「お前たちは他の連中より『存在論的に』上だ」なんて一言でも言ったか？ 全部ノーだ。

むしろ「後の者こそ、先になる」とまで言ってる。パリサイ人や律法学者が立派な服を見せびらかして「敬虔ぶってる」のを厳しく批判し、「祈るなら部屋でこっそりやれ」「人に見せびらかすための祈りはするな」と警告までしてるじゃないか。

そもそも教会が福音の教えから完全に逸脱したのは、コンスタンティヌスの時代あたりから。アンティオキアのイグナティオスみたいな一部の人間が事実上の階級制度を作り上げたんだよ。後から「ペテロが最初の『司教』だった」なんて、都合のいい理屈をこねてるだけだ。",llm,
"神の教えを自分たちに都合のいい、生ぬるいものに捻じ曲げるのが流行ってんのかね。

最近の連中の手口、見え見えなんだよ。

まず「旧約は古いからポイ。新約だけでおｋ」とか言い出す。

次は「パウロだのヤコブだの、説教臭い箇所は全部スルーな。イエスの言葉だけ見ましょうね、はいはい」と来たもんだ。

で、今度は「ヨハネ福音書は特殊で比喩的だから」とか言って、『ヨハネ文書』なんて小難しい学術ぶった名前をつけて、面倒な要求から全力で逃げるわけだｗ

最後は、当のイエスが言った「罪を犯した者を戒めよ」とか「もしあなたの片手が罪を犯させるなら…」みたいなガチでキツい部分もきれいさっぱり忘れて、耳障りのいいフワフワした言葉だけをつまみ食い。

お前のコメントがまさにそれだよ。鏡見ろ。",llm,
"そもそも福音書を読んだ人間が二人いて、同じ結論に達したなんて話、聞いたことねーんだよ。

つーか、書いてる当人たちの間ですら解釈がバラバラなんだから、話にならん。

やたらと事を荒立てるのが好きなのは、なにも今のローマ法王だけじゃない。教祖のイエス自身、相当なもんだっただろ。いい迷惑だったろうな、周りの弟子たちは。",llm,
"いかにもって感じの言い訳だな。全くの見当違いだ。

こっちは会計の専門家として、ボランティアで教会の経理を手伝ってるから言ってるんだが、「25%」どころの話じゃない。あんたが挙げたような活動には、もっと、ずっと多くの金が使われてるんだよ。あんたが関わってるNPOとやらは違うのかもしれんがな。そこは知らん。

そもそも、うちみたいな巨大宗教法人が行政から事業を委託されて、税金が投入されてるプログラムを運営してることも知らないのか？ 何十年も前から、政府が直接やるより上手くやれるってんで、多くの公的機関から事業を「請け負って」きた歴史がある。その金は坊主や聖職者の懐に入るわけじゃなく、あくまで貧困層への救済活動や支援活動のための費用だ。あんたのNPOは違うのかもしれんが。

言っとくが、俺が言ってる「慈善活動」ってのは、そういう行政と繋がってるものだけじゃない。教会が独自にやってる、政府とは無関係の活動も当然あるわけだが。まさか、それすら知らないなんて言わないよな？",llm,
"は？カトリック信者一人一人の寄付状況でも全部把握してるつもりかよ？

税金払ってるから慈善活動は国がやれ、とか言って寄付から逃げてるパヨクなら知ってるけどなw

だから、たとえ寄付先が多少アレな団体だったとしても、カトリック系の団体に寄付した信者が「自分はちゃんと貢献した」って思うのは何も間違ってねーだろ。

ちなみに俺は、そういうデカい組織じゃなくて、もっと身近なところで、自分の地域で困ってる奴に直接施しをやってるわ。",llm,
"昔から地元の檀家さんたちが何十年も支えてきたお寺のことを思い出すよ。総本山のお偉いさん方は、まるでコンビニのフランチャイズを畳むみたいに、一方的に「はい、閉鎖ね」と決めるわけだ。閉鎖された寺の多くは、信徒たちが金だけじゃなく、時間も労力も無償で捧げて、必死に維持してきたってのによ。

で、結局、本当の地主である坊主どもは何をするか？ あっさり門を閉ざして土地を売り払い、その利益は丸々自分たちの懐へ。そのくせ、まだ平気な顔して「お布施が足りません」だのなんだの、金をせびり続けるんだから救いようがねえ。

まず自分らのその腐った体質をどうにかするまで、一円だって出す価値はないね。",llm,
"あの宗教法人がやってる大学だの福祉施設だの、その資金はどっから湧いて出てくると思ってんの？

信者から搾り取ったカネで、ハンバーガー売るみてえな俗っぽい商売してるだけ。天からマナが降ってくるわけねーだろw

お役人様とか法律のセンセイ方みてえな、お花畑な頭の奴らには衝撃的な事実だったかな？w",llm,
"そもそも宗教団体を税金で優遇してやるのが「正義」だなんて理屈は存在しねえんだよ。

信者どもは、何が正義で何がそうじゃないのか、もうちょっと頭使って考えろっての。

感情論ばっかで、判断の基準がガバガバすぎんだよ。",llm,
宗教法人なんてとっとと解散させて、土地も建物も全部売り払っちまえよ。,llm,
ていうか「カトリック系慈善団体」とか言ってるけど、活動資金の9割が税金チューチューじゃねえか。その点、モルモンは国にタカったりしねえからまだマシだわなｗ,llm,
どうせそれも、頭お花畑の信者からお布施を搾り取るための商売だろ。結局、金が権力なんだよなw,llm,
"必死のコピペ連投、ご苦労なこったなw 指が擦り切れるほどやったんだろう？ だが、おかげでアンタが一方的な引用を垂れ流すだけのヤツだってのがよく証明されたわ。その一点に関してはマジでブレないよな！

さて、Pandora17への続きだ。
教会ってのは、デモ行進だの政治家へのロビー活動だのに躍起になるばかりで、肝心の「福音のメッセージ」とやらは実践しやがらねえ。俺が昔カトリック系の慈善団体にいた頃、未婚の妊婦に経済的な支援をするプログラムがあったんだ。社会的に追い詰められて中絶を選ばざるを得ないような女性たちに、別の選択肢を選ぶための後押しをする活動だった。地元の教会を回って寄付を募ったり、教区に運営資金を頼んだり、めちゃくちゃ走り回ったんだがな。
結局、寄付はクソほども集まらねえし、地元の司教様は『教区にそんな“余分な”金はない』の一点張りで、全部パーだよ。
(Pandora17へ続く)",llm,
"そのセリフ、ドラン枢機卿にでも聞かせてやれよ。最近の記事読んだか？献金が減ってニューヨークの神父どもにブチギレたって話。
「教会はビジネスじゃない」？笑わせるな。「一部の教区は完全に営利目的の組織です」ってのが現実だろ。",llm,
