response,source,text
"この不祥事、知れば知るほど、あいつら聖職者のお偉いさん方は何も分かってないし、そもそも信者のことなんてどうでもいいんだろうなって確信するわ。

あの組織には、人間を格付けする「カースト」みたいな文化が根付いてるんだよな。司教は神父より偉くて、神父はそこらの男より上で、男は子産み機械（女）より上。子供の価値なんて、ゴルフ場のキャディ以下だろ。

今の法王も、前の法王も、あの「聖人」とか呼ばれてるヨハネ・パウロ２世とやらも、本気になれば全部正せたはずなんだよ。連中のやってることってのは、結局「何もしない」っていう選択の結果そのものだ。口先では立派なこと並べて、豪華な儀式やって、ありがたい本を山ほど出して、権威を振りかざしてるくせに、結局なーんにも変わってねえじゃんか。

自分たちの腐敗っぷりが見えてない。こっちがそれに気づいてないとでも思ってる。善意で組織を良くしようとしてる真面目な信者が愛想尽かして去っていくのを、ただ黙って見てるだけ。もう、これだけで全部お察しだろ。話にならん。",llm,
"あまりに正論なんで通報しといたわw

マジで同意だわ。信者を無理やり囲い込めた時代はとっくに終わってんだから、宗教法人どももやり方を変えなきゃ、あとはオワコンになるだけ。いつまで中世レベルの化石みたいな伝統にしがみついてんだよ。

日本の偉い坊さんだって、今じゃ信者離れで傾きかけてる斜陽企業の地区マネージャーみたいなもんだろ。あんなのを本気でありがたがってる奴、まだいるの？w",llm,
"「指導者様（笑）はどこにいるんだ？いや、それ以前の問題だ。なんで司教どもは街頭に出てこない？こんなのはカトリックだけの問題じゃなくて、人間全体の問題だろうが。

連中は安全な教区庁のドアの裏に引きこもって、口先だけで行動が伴ってない。抗議の最前線に立ってみろってんだ。

危険だって？当たり前だろ。昔は貧しい信者のために、何度も命を懸けたオスカル・ロメロみたいな聖職者もいた。そうでなきゃ、モニカとかいう人の『いつからか、司教は羊飼いであることをやめ、大株主（＝大口献金者）の顔色をうかがう国際企業の副社長に成り下がった』って意見に同意するしかないわな。",llm,
教会の偉い連中も同じようなもんだが、あっちはバックについてる権力とカネの桁が違う。,llm,
的を射た記事だな。今さら教団の上の方の人間が何言ったって、下の信者は誰も気にしてねーよ。権威なんてとっくに地に落ちてる。連中が特定の話題にムキになるのって、『教義上の理由』とか言ってるけど、結局は自分らの歪んだコンプレックスの裏返しだろ。,llm,
"カトリックの司教たちが声を上げろだのなんだの言ってるけど、もうとっくに手遅れなんだよな。指導者ヅラする資格なんて、何十年も前に失ってる。

中絶だの同性婚だの、そういう問題に口を出すときだけは威勢がいいけど、それ以外じゃ司教なんてクラゲ並みの腰抜けだろ。俺はあいつらが福音の教えを守るために権力に立ち向かうなんて、微塵も期待してないね。やるわけないじゃん。裏で糸を引いてる自民党がそれを許すはずがない。",llm,
それな。今どき司教（笑）なんて信者の大半は眼中にないだろ。とっくの昔にやらかして権威なんて地に落ちてるんだから自業自得。,llm,
"いつまでも信者を騙せると思ってるんだろうな、あの連中。
司教どもは自分たちの権威が日に日に失墜してるって事実に、マジで気づいてない。

確かに医療がどうとか声明は出してたな。聞こえはいいけど、誰も気づかないレベルでコッソリと。わざとだろ、あれは。
性的虐待の問題と一緒だよ。あれだって、しょっちゅう訴えられてなきゃ、今頃どんな言い訳してたことか。
なのに中絶問題になると、いきなり屋根の上から大声でわめき散らすんだからな。やればできんじゃん！！

要するに、やる気がないだけ。
口先では綺麗事を並べて、結局は貧しい人々より金持ちや権力者にゴマをする毎日。
教会が内部から崩壊してるのに、お偉いさん方にはそれが全く見えてない。教皇はさすがに分かってるっぽいけど、多くの司教たちは彼のことが気に食わなくて仕方ないんだろうなw",llm,
"提灯記事乙。米国の司教協議会が、教皇フランシスコが掲げる「慈悲深く、協力的で、シノドス的な教会」とやらを本気で受け入れてるわけないだろ。

あいつらにとっての「信教の自由」ってのは、結局、自分たちの組織で働く人間の私生活まで支配する権利のことなんだよ。民主主義国家の市民としてどう行動するかすらコントロールしようとする。

記事中のゾッとする文言がこれだ。「カトリック機関は、『カトリックであることの意味』の理解を深める道筋で、その中核的サービスを強化する」だと。さらに「信徒たちの間でカトリックのアイデンティティを強化する」だとさ。

司教どもが言う「カトリック・アイデンティティ」なんて、中身はスッカラカン。要は、現代じゃとっくに通用しないルールや「伝統」とやらに盲従しろ、黙って従えってだけの話。これじゃ完全にタコツボ化だよ。自分たちと違う組織、例えば同性婚やエイズ予防のコンドームを支持する団体とは、たとえ共通の課題があっても絶対に協力しないっていう排他的な精神。

いつまで中世のつもりでいんだよ。1500年代の権力構造でも復活させたいわけ？",llm,
"勝手に信徒全体の話にすり替えるな。
一部のリベラル気取りの似非カトリック共が、堅信式まで司教がいなくても平気だからといって、皆がそうだと思い込むなよ。

いつの時代も、奴らの価値観がカトリックの「標準」だったことなんて一度もねえんだよ。笑",llm,
"まあ、百年後か千年後か知らんがな。
いつかはこの国の偉い聖職者様たちにも、まともな信仰心が芽生える日が来るんだろうよw

いや、来ねえかもな。今の上にいる連中は完全に終わってる。結局、俺たちみたいな一般信者が、あの連中をどうにかするしかねえんだ。
奴らは権威主義で教会を支配しようとしてるが、こっちが認めなきゃ何一つ力なんて無えんだよ。

もう潮時だ。坊主どもが好きに使えるカネは、1円たりとも献金するな。
大聖堂だろうが近所の教会だろうが、奴らが説教を垂れてる間は、全員で背中を向けてやろうぜ。あいつらは今の社会が混乱してる原因の一端だ。

セックススキャンダルとカネの問題での無策っぷりは伝説級。特定の政党との癒着でこの国を腐らせてきた罪は重い。そもそも、時代錯誤も甚だしい性や家族についての教えなんて、吐き気がするだけだ。

ああ、いつの日か、この国の坊主どもにも本当のキリストの愛とやらが届くといいな！（棒）",llm,
"まあ、確かに最近の教会のお偉いさん方は、これまで無視してきたような問題にも口を出すようになったな。世の中のギスギスした対立に気づいて、何か言わなきゃマズいと感じ始めたのかもしれん。

だが問題は、右からも左からも、とっくの昔に見限られてるってことだ。

片や、中絶だの伝統的家族観だの、いつものお題目しか聞きたくない連中。それ以外の問題は教会の公式見解なんて不要だと決めつけてる。もう片方は、どうせ体制側の説教だろうとハナから馬鹿にして、たとえマシな意見が出てきても耳を貸そうともしない。

どっちにしろ、あのお偉いさん方に本気でやる気があるなら、せめて信者同士がお互いにもう少し寛容になるよう働きかけるだけでも、まだ社会の役に立てるかもしれんがな。このままじゃ、口先では皆が「愛国」とか言ってるこの国が、マジで内側から崩壊するぞ。",llm,
"「高位聖職者が政治と宗教の境界線でウロチョロしてる時間なんて、全体の5%だの15%だの」…

んなもん、知るかよ。どうでもいいわ、そんな細かい話。

信者どもは、奴らの総会の前でプラカードでも掲げて抗議して、国税庁とか監視団体に「こいつら政教分離をナメてますよ」ってタレ込むべきなんだよ。結局、あの手の連中がビビるのはカネとスキャンダルだけなんだからな。",llm,
"今の日本の聖職者のお偉いさん方が直面してる最大の壁は、間違いなく「時代とのズレ」だよな。

内輪の教義闘争に明け暮れて現実から目を背けるか、それとも真の指導力を発揮して問題と向き合うか。道は二つに一つだろ。自分たちの手に負えない問題があるにせよ、その悪影響を少しでも和らげることぐらいできるはず。それすらできない奴がいるってのは、どういう教育を受けてきたのか、その程度が知れるって話だ。

キリストが何度も戒めた「独善」という罪を、当の坊主どもが全く学んでないんだから、救いようがない。",llm,
